Questions,Male
what embarrassing thing have you done at work school that your family doe not know,1
who the rudest celebrity you ve met,0
what one personality trait of your so that only you get to see,1
fellow woman how to stop feeling depressed about your appearance comparing yourself to your friend,0
men what cute thing ha your so done recently,0
my female friend advised me that should nt shower my boyfriend with so many present because men do not like to be taken care of like that men is this true for you,0
askmen how can you tell if girl dress for herself or to attract guy,0
have you ever set out just to fuck particular girl woman and then wound up developing feeling for her if so why did your feeling grow change,0
meta maybe this subreddit should be called askmenaboutwomen,0
would you want to be friend before being so why or why not,1
woman who believe in astrology zodiac sign why,0
you buy pop water at work and realize there is gin in it by some crazy mishap what is your next move,1
do you believe in any form of an afterlife if so which one,1
how do ask guy to be my fwb,1
men who mutter to themselves in the bathroom stall at work what the fuck are you doing,0
doe anyone remember those sweet virtual paper doll dress up website back in the early number,1
woman who wear lot of makeup why do you do it and are you comfortable in your own skin,1
what your favorite outfit to wear,1
what your favorite song to listen to when you re on long road trip,0
can girl change her appearance to get herself out of the friend zone,1
online woman shopper what are couple of the best website to buy clothes,1
people in charge of hiring people what difference have you noticed in the way men and woman apply for job,0
how could recreate make night for my girlfriend that is sort of like prom,1
how many men have been receptive to butt play in your experience,0
what is the appeal in jewellery,1
it seems that good number of men here do nt want someone they are in relationship with to post sexual content of themselves online but m assuming many of the same men are porn user what give,1
what do you think about the double standard that make it not only acceptable but cool to shame men for penis size and being sexually inexperienced but not acceptable when the same is done for boob butt and sexual experience in woman,1
what a sweet memory you have of someone you re were interested in,0
how short would you say is too short when it come to short men woman,1
married woman who don have many female friend sister or female cousin what did you do for bridesmaid etc at your wedding,0
woman who are retired or close to retiring what are something or one key thing you want to say to young woman just starting their career,0
guy of reddit what make your sex drive go down in long term relationship,1
how do get over rejection,0
what the kinkiest taboo thing girl ha ever tried on you or wanted to try with you,1
it coming up who are you rooting for to make an nfl playoff push,0
do most woman want hillary for president,0
guy had to throw out my designated spiderbro who would keep my room free of mosquito what your friendship breakup story,0
when performing oral sex on male do you spit or swallow,0
redditors with gay son how did you handle it when your son first came out,0
what have your experience been with antidepressant and other depression treatment,1
what fictional male character should not have got the girl,0
is anyone exhausted by the constant maintenance and grooming required to look and feel good,0
lady what do you really want your so to do but you re caught in that ridiculous cycle of but if tell them then they re not really doing it because they want to,1
lady what is your attitude towards sex,0
what is the porn video you always come back to,1
why is sagging looked down upon,0
woman who went from very dysfunctional relationship to very healthy one what wa the biggest surprise eyeopener,0
men of reddit what are alternative to the gym,1
what is very hard to stop once you start doing it,1
which clothing do you perfer slimfit skinny or neither,1
how do you feel about the phrase men are afraid that woman will laugh at them woman are afraid that men will kill them how much truth is in it given your personal experience,0
do you love your fellow man your self or very much like christianity teach or not why,1
what is something woman think men find hot but it actually turnoff for you,0
using your dick a catapult how far can you throw something,1
what did you guy eat when you went on diet and wanted to start lifting,0
men how do become an interesting person again,1
what do you think of guy approaching number who mostly date woman number or more year younger and doe nt commit,0
what ha been the most romantic frugal date you have been on,1
uglt duckling turned into conventionally better looking what ahs changed,1
how many of you would be content or even happy without ever having to work again,1
how to make her think it not my first kiss,0
so met this girl versus so met this woman,1
what a good hobby for any guy to pick up outside of work,0
just by your look where do you rate yourself from number to number,0
what movie from high school or college do you feel hold up beyond the nostalgia factor,0
men who did nt spend time with their father how did you feel after he passed away,0
doe anyone else just have to wear pajama lounge clothes when you re at home,0
woman who got pregnant from onenight stand or casual partner and kept the baby what wa your experience,0
how is your average relationship,0
what are the lesser known problem of being an ugly or unattractive woman,0
how to fight occurring period of wanting to go nocontact with everyone,0
what wedding trend do you think are going to age poorly,0
how did dressing up nicely everyday and selfcare change your self image relationship with yourself and others and outlook on life what are your favourite hack,0
what do men usually use to fill their big pocket,1
what is the pettiest thing you have done after breakup,0
lady this might be bit too controversial but what do you think the difference between body positivity and normalizing obesity is,1
which anime girl did you choose to be your waifu and why,0
what make you want to sleep with someone on the first date and what doesnt make you want to sleep with someone on the first date but still down for number nd date,1
do you guy like girl that you can turn on easily or do you like girl who get turned on not so easily explain why,0
how do you deal with your girlfriend hating your best mate and constantly insulting him,0
what do you think ha been the best film of number thus far,1
how is your so different from the dreamgirl guy you envisioned in your youth,1
doe anyone else feel like their face attractiveness fluctuates daily,1
should be insulted that he chose to come on my back,1
what wa the reason you walked out on first date with someone,0
am young woman who just discovered that love cheese after avoiding it my whole life what kind of cheese would you recommend try next urgent,0
how would you feel react if your girlfriend told you that you could sleep around while she would nt,1
doe your significant other have similar body type or skin eye hair color your favourite pornstar what it like being with someone who doe nt have these physical attribute,1
what step could an employer take to reduce the wage gap along their employer,1
do any of you guy ever go through nihilistic slump where nothing matter and there no reason to anything,1
men who work long shift how do you have energy to do stuff after you re off,1
how do parent enjoy holiday without their child,1
if most gay male porn were made for woman like most lesbian porn are made for men what do you think gay porn would be like,1
m curious what make person seem intelligent look how they present themselves conversation,0
what the creepiest you ve ever unintentionally been to woman,0
is it wrong to not want to date someone because she ha high past sexual partner count,0
lady of reddit who worked in call centre how did you escape,1
how doe guy behave when he love someone but ha nt said so yet,1
men what are you oldfashioned about,1
what do you eat when you re sick f ck,1
how do shut up mind when you re trying to focus on something else,1
what is the funniest vandalism you ve seen,0
how attractive would woman you re dating have to be to say yes if she asks you to cum inside her,0
what is the strangest rule in your household,1
screw all these relationship question question about men lady what your favorite number movie,1
what kind of porn do you like to watch when you masturbate,0
inspired by brian zembic body mod opinion on bi straight guy with female breast implant would you date one,1
men who pay for tinder why spend money,1
if you were friend with your o before you started dating how did your relationship change from platonic to romantic,0
how common is it for men to call text or facetime each other just to casually talk,0
lady who have quit job due to harassment how do you discretely explain to future employer when they ask for your reason for leaving,1
who gave you the best blowjob of your life and what wa the secret of their technique,0
what have been some reason why you haven made girl that you like and have been consistently seeing your girlfriend,0
what is your favorite part of being human feeling defeated by human this week and need some uplifting,0
how would you feel if you had son and he gay,1
what is your opinion of anime called boku no pico,0
why do nt men get much of thrill over fictional romance woman do men fall in love too so why do nt they enjoy good love story and if you do what are your favorite tv book movie,1
how did you choose your major,1
when looking for ltr m always hoping the girl doe nt want to have sex for the first few date am in the minority here,1
guy what the most exotic restaurant you ve ordered chicken finger from,1
why do period poos smell worse than regular poos asking for friend,0
skinny woman be honest what do you love about being skinny,1
men who quit drinking what did you do with your time to distract you from the boredom,0
anyone here ditch career in stem academia for more creative pursuit or nonacademia how it go how you make the jump,1
what do you think of woman who are into voyeurism,0
what the weirdest thing thats ever come out of your vagina,0
which watch is not expensive and good looking,1
saw post today where the op stated that self love come before everyone elsebesides your child do you agree or disagree and why,0
how do you feel when you are hanging out with your friend and she is hit on by guy,0
what is the most intimate nonsex thing you do with your partner,0
recently complemented my wife hair in an older picture and she took that i hate her current hairstyle how have you messedup this week,1
pregnant people how do did you wish people treated you while visibly pregnant,0
what do you hope to be remembered for,0
what bloody fight have you been in martial art bout or street fight,1
is this something acceptable for man to do during sex,1
lady how do you deal with long distance relationship,0
do most woman prefer guy who watch sport,1
those who like to just hang out naked when they re home alone what are we dresser missing out on,1
woman who were the last one in your social circle to get married and have kid but saw it happening much sooner in life how did you deal with it,1
what is your opinion on the protest in hong kong,0
how much doe family mean to you,0
how much money do you spend per week on grocery and how many people are you feeding with the food you buy,0
do you care about net neutrality why or why not,1
men who never plan want to be married what is your reasoning expectation being in serious relationship,0
how do deal with threesome in gf past,1
how do you set goal,1
men if woman wa to ask you on date how would you prefer she do so,0
my girlfriend said she wa promiscuous in highschool and it is driving me insecure fuck,1
so lady is micro very small penis honestly dealbreaker,0
woman who have brother who are part of the incel mgtow crowd how doe it impact your relationship,1
just turned number and it feel like woman are not these magical creature anymore did you felt the same you got older,0
if you think pussy should nt be synonym for weakness do you also think dick should nt be synonym for meanness rudeness,1
how do you respond when your so is taking too long to message you back,1
woman are often stereotyped being more emotionally mature than men what example do you have of woman being emotionally immature,1
how ha age changed your view about sex,0
have you ever fell in love with ugly man woman what wa the reason if the relationship is still going on how it is going on,1
deleted my facebook about month ago find my self caring le about bullshit and feel way better what change have you guy made in your life recently no matter how big or small that made you feel better,0
how do you respond to guy texting you when you re into the conversation versus one you want to kill,0
what percentage of woman on online dating site do you think are there only to boost their ego,0
guy who have taken gender study course have you felt like you were hostile unwelcome environment,1
why do woman care for or more involved in social issue than men,0
is anyone else sicktodeath of getting relationship zoned,1
have you ever had gloup and how did you do it,1
what body part do you like in man,0
this millennial burn out article ha theory pertaining to just woman called the second shift the idea that woman who ve moved into the workplace do the labor of job and then come home and perform the labor of homemaker doe anyone else relate to this link in comment,1
what make freak in the sheet different from your average sex partner,0
what ha your so been mad at you for that you had no control over,1
dear sir of this website are you scared of what your so becomes when she age,0
how wa your experience with male gynecologist did you feel like he took you seriously,0
what are some green flag some dead give aways that the girl will propably be awesome,1
what moment made you look at your so and think wow they must really love me,0
is it common to control period with birth control pill any side effect,1
lady what sex act are you scared to ask your partner to do,0
did you ever break up with partner due to them being too clingy and or babyish what happened,1
what wa girl worst reaction to you trying to kiss her,0
poor broke and down on your luck lady what are some thing financially stable people say that annoy you,0
every time see guide dog working out in public get overwhelmed with emotion and cry little lady how can you literally not even,1
have any of you guy ever lied about scarf,0
announcement update to our moderation policy regarding thread that discus user experience of trauma assault and abuse,0
men in good stable serious relationship what were some early green flag,1
what is the best way for man to react if another man hit on you in front of your so,1
what do you think about guy who have never dated before,1
if male friend wa to admit stronger feeling and ask you out what would be the way you prefer him to go about it,1
have you ever broken up with girl because she slept with someone else,0
just learned that quizilla is no longer around anyone else spend their tween year taking stupid quiz,0
how often do you think about fucking those around you,1
woman of reddit who want kid what your reasoning,0
what have you learned from your past relationship,1
far horseback riding go what the general consensus yay or neigh,0
compared to men do you think it easier harder or about the same difficulty for woman to find casual sex partner xpost,1
what are your favorite gun and why,1
how many acquaintance do you have how many friend do you have,1
men of reddit what make you respect one girl more than the other,1
married men what are your engagement proposal word of wisdom for guy who ha no father figure and never learned how to go about doing this stuff,0
went out last night and met girl who wa hilariously awful what are you story about meeting terrible woman,1
why do you think we aren hearing more guy complaining that their female friend are always trying to date fuck them,0
do you think that male attractiveness is different from female attractiveness seems like woman often care more about other woman look than men,0
in meeting woman contributes an idea and is ignored man repeat the exact same idea and is praised for it in your own experience how true is this,1
what the worst thing you ve said to your so in anger,0
what caused the resurgence in popularity of the hitler youth hair style,1
what are some thing you do to feel better when you are feeling insecure,0
fellow men how can lose weight,1
lady what kind of facial feature do you like on guy,0
did your wife go through wild phase,1
what masculine trait were you encouraged to take on when entering the workforce,1
what the best career move you made,0
if you were to have sex with sandwich what would it be and why,0
what is your go to outfit,0
my wife of almost number year just passed away suddenly at number she wa the only woman ve ever loved have number kid and nuclear war with her family what should do,1
my favorite hoodie ha been destroyed am looking to love again and find hoodie that actually ha large hood and not something that wrap my head like condom where can find one,0
why do the majority of guy deny themselves the fun of being in mmf threesome,0
how do tell my teacher bape,1
where are the guy who went from fit to fat here is my open letter of admiration,0
how many people think that the right hairstyle can change the overall image,1
is there someone who keep coming back into your life in either platonic or romantic sense but due to extenuating circumstance your friendship relationship with them doe nt work out what is your story,1
why do some men struggle to describe their thought process when it come to sex,1
what were you certain wa not just phase but turned out to be totally just phase,0
would you rather date girl that ha had sex once with thousand different guy or girl that ha had sex thousand time with the same guy,1
what number book have you read that you think expanded your mind changed your view of the world had the most knowledge,1
how do small medium sized men feel about woman who are medium large,1
other than your groin what is your favourite place to be touched,1
do you ever think about the person you like while masturbating,0
what advice would you give to number year old you,0
have you ever clicked with someone perfectly and enjoyed each other company so much but realized that long term relationship could never work out how did you accept that and stop longing to be with that person,0
what your best funniest story of man not understanding something about the female body how menstruation work where thing are located etc,0
lady who have been married number year what are the characteristic that really matter in your so that you did nt think of when you were single newly wed,0
woman with an exciting sounding job like paramedic cop skydiving instructor etc what something really boring that people do nt realize you actually spend lot of time doing at work,0
what kind of situation could be normal for men but weird for woman,1
what do you do when feeling lonely,1
do you believe social medium ha normalized dramatic change being done to yourself such a nose job or body change if so ha it affected you in any way,1
another man gave your so foot massage what do you do aside from throwing him out window,1
why do you think shorter men face discrimination because of their height did nt know this wa thing until last night,1
if you have had how the conversation with your uber driver went what were they about,0
woman with traumatic past bad past relationship or trust issue in general how did you learn to fully trust new and wonderful partner,1
woman who ve received phone number from stranger what is your probability of actually contacting them,1
what the worst heartbreak you ve ever experienced and how did you get through it,1
how long after you met your so did you ask her out,1
experienced woman what are some subtle sign in man behavior that tell you he is mysogynist,0
uk member of askmen what shop do you get clothes from,0
giving birth what you wished they told you about it,0
men of reddit do you get horny when drunk or do you find that sex is the last thing on your mind when you ve had too much to drink,0
if gal act masculine do you find it turn off why think it fun to be masculine sometimes,1
what did it take you to finally forgive the person who cheated on you,0
what wa the fastest woman ever had sex with you after hearing your modified muffler bassy sound system of your car,1
men who complain about rejection and loneliness why do most of you seem to have ridiculously high standard when it come to woman,0
honestly is miley cyrus attractive,1
what is your opinion on giving your daughter vibrator in order for her to learn that masturbation is ok and part of growing up,0
father of reddit what trivial stuff do you regret not doing for or with your kid when they were young,1
men who ve broken thing off with great girl in order to play the field how it go,0
what the best piece of advice you can give to the father of little girl,0
current bf is put off by how low my number is,1
men who have surgically grafted cow udder to their buttcheeks to try and impress their crush how did it work out,1
what to do when someone is flakey,0
you are about to go deaf in number hour what the last thing you would want to hear,0
woman who pee on the seat of toilet and leave it there why do you do that,1
what that one goto song video you use to test out new pair of earphone,1
who is your inspiration and why what would you say to inspire others,1
what little touch do you do to your apartment to make it feel more yours,0
meta ve been seeing downvoting on respectful productive discussion lately and it concerning to me am alone on this,1
how to reassure without being disparaging,1
woman at what age did you peak in physical attractiveness,1
just wanted to say thanks,0
how do you find girl that share similar value belief maturity,0
what the weirdest social interaction you ve ever been part of,0
what is it about woman driving stick shift that attractive,1
what do you recommend for body lotion,1
do you believe that really attractive woman are rarely asked out because men are too intimidated,0
woman what effect doe the pill have on your mood,1
what to do about good friend who is getting bit of an ego,1
what movie myth scarred you when you were child,1
what the best game to play with young daughter,1
what wa your strategy for leaving an unsafe relationship packing moving out etc,0
dad of askmen what is the best advice you give to your daughter on judging man character,1
what scream peaked in high school,1
what phone are you currently using what case doe it have on it,0
have you ever felt been physically objectified by romantic partner in relationship if so in what way did you enjoy it or not enjoy it how did you deal with it or resolve it,1
lady what a nonsexual act that turn you on,1
how have you made friend an adult have any been life long friendship,0
what is your whyididntreport story,1
what song becomes better when you replace the lyric heart with fart,1
how to avoid shaving cut,0
what your goto comfort food tv show,0
how should you handle winning lottery,1
will be shopping for fall clothes where can the most fashionable clothing for men be found,0
do you consider people in the tea party or the republican party to be awful folk,1
when wa the last time you felt like woman like in the shania twain song,0
woman what is sex tip you wish you could tell every guy what is something guy did in the bedroom that blew you away,0
why do like number of the faq on askwomen have to do with men,1
any recommendation for good show to watch on netflix,0
what exactly would an eight story tall crustacean from the protozoic era do with tree fiddy,1
gym goer do you have any woman specific tip for those of with new year new me gym resolution,1
what would you think of an attractive cute girl who doe nt have social medium facebook insta etc,0
where did you guy buy your bed,0
what the most infuriating thing man ha tried to mansplain to you before,0
what go good with men stonewash denim levi jacket,1
what subtle thing men do is actually really obvious,0
what make you wake up every morning,1
what your when you look at someone through rosecolored glass all the red flag just look like flag story,0
guy how did you find something worth living for,0
do you ever walk in on other woman taking selfies in public restroom what go through your mind when this happens,1
what are the obvious sign of affection you give that your crush seem to miss,0
how ha becoming physically fit help you hook up with hot pretty girl,1
what your goto meal before you go on night out drinking,1
ha significant other ever criticized your weight did it encourage you to change your appearance how did their comment affect your relationship,1
fellow men of reddit what your favorite guilty pleasure song,0
is there smell that brings up an old memory for you,0
men of reddit how doe one go about picking up girl from their church,0
what societal pressure are there on men to man up,1
what the best way to tell my boyfriend he is not satisfying me in bed,1
what happened that brought you to the realization that you knew something had to change,1
what is the one thing that you are the most proud of yourself for,0
