Questions,Male
how do you lend your gay bros helping hand when dealing with homophobic jackass,1
why aren womenonly night club thing,1
just checked my pocket for my phone while with the other hand wa browsing reddit on my phone in what minor way doe your brain betray you each day,0
how do tell if you re flirting or just being friendly,1
what are some thing you do for safety reason that most guy would nt think twice about,0
what are some harmful thing that movie are trying to normalize,1
any of you lady facing quarterlife crisis how do you handle it,0
how to commit to self imposed dating social life exile,1
married lady of reddit did your current ex spouse get way too drunk at your own wedding how did you handle it and how did it effect the beginning of the marriage,0
woman who work multiple job when do you find the time to work out and what is your go to workout,1
what is healthy alternative you treat yourself with after bad day or heartache rather than chocolate cake or junk food,1
how often do you see guy and say to yourself wow he hot or would love to see him naked go to bed with him,1
lady how long can you go without sex,0
what do you struggle with when it come to your christian faith,1
what food and restaurant trend do you actually like,0
woman of reddit who have experienced breakin at your home what wa your form of self defense,0
men why are nt you guy into dating female doctor,1
babysitter who have slept with the husband father how do you feel about using babysitter for your own child,0
what doe taking yourself on date look like for you,0
do you agree that it in our biology to sleep around with multiple woman or men,0
would you date transman,0
share cubicle wall with someone annoying who among other thing play music loudly through bluetooth speaker rather than deal with this maturely how can subtly mess with this person,1
are you team white gold or team blue black,0
lady who were bullied because of your look when wa the first time you realized someone wa genuinly attracted to you,0
men with noticeable high sex drive what is it like,1
what kind of makeup do you wear to work,1
lady of reddit how do you make yourself feel confident when you feel like you re ugly,0
when are we going to stop making fun of guy with small dick or at least stop worshipping those with big one why do people still do this,0
do you personally ever find short men number number or shorter sexually attractive,0
what do you talk to girl about,0
what wa the greatest moment of woman intuition you have ever experienced,0
how to get rid of random headache,1
what would you do if you found out your man wear shoe lift,0
what is your morning routine,0
what the quickest and easiest method of shaving your leg,1
what something you did you better yourself after break up,0
doe it ever bother you that men are the one expected to initiate relationship,1
man think it absolutely dumb and archaic that a woman take their man name when wed how do you feel abou this,0
what your go to pre work out supplement,1
woman of reddit only did screw up,1
how many girl day do you see that you think are out of your league,0
are american taught at school that they won the vietnam war,1
looking to get new bible anyone have review on the she read truth csb study bible or something similar,0
how can guy compensate for his look,0
men born with sight m losing mine at number what sex act is worth going out of my way to try before lose my vision,1
how do you get shy guy to open up,0
what are some beauty hygiene tip you would give to guy,1
how would you feel if you are home alone and guy working in your neighborhood utility worker landscaper road crew approached you on your property and asked you out,1
guy who settled for woman they re not actually in love with what your story,1
what are your favorite salad recipe,1
what do you think can be done to stop body shaming so that future generation of woman can become stronger and live without the burden of the perfect body,0
what are le obvious sign that you should end your relationship,0
thin woman where do you find clothes that fit,0
redditors who have been happily married for number year what do you and your partner do to stay so happy and stable in your relationship for so long,0
how do communicate to my number year old that being fat is unhealthy without body shaming her,0
why is it ok to virgin shame men when it not ok to slut shame woman,1
how do you begin to be comfortable in your own skin what do you do to gain maintain self confidence,0
how do you stop being so overly sensitive,1
how often do you hate being woman because of your body and your bodily function,0
what do you guy think of pokemon go so far,0
what is the best technique for giving good breast massage in my experience girl seem to like it when push their breast up and or together but not when pull down what do you think lady,1
woman who make over dollar number year what do you do,1
how ha catcalling worked for you,0
for the other dude that do nt care much for mainstream sport what other form of competition do you like to watch,0
at what age did partner made you orgasm for the first time,1
how do your stop thinking about your ex who dumped you because they like someone else,1
where do you see yourself in number minute,0
what the most unrealistic expectation partner of yours had when entering relationship,1
how do you stay interesting an adult,0
how do go back to school without cosigner for loan,0
how do guy check out girl cleavage do you notice it,0
what recent novel about contemporary relationship not romance have you totally loved,0
in your opinion what the most useless tetri block,1
what kind of small mundane magic are you capable of,1
what the worst thing man ha tried to tell you about your own body,0
what is your opinion of woman who hold belief,1
what are you sick of seeing in guy profile on tinder,0
what made you interested in getting to know your current or past so,1
how doe working out effect the size and shape of your breast,1
have you really been rejected more often than you have rejected girl yourself,1
what your story of someone crossing boundary when approaching you in romantic or sexual manner or when did someone come on too strong,1
are men too wimpy nowadays,1
how should we raise our boy to be better men,0
how long did it take for your significant other to feel comfortable enough around you to fart how long did it take you,0
don have dad and it used to be okay but now need one how do get through growing up without dad or any male role model number,0
what type of affection do you like from the person you re seeing with,1
egalitarianism feminism what are your thought,0
what normal thing do you guy do that you do for abnormal reason,1
what to do when girl is acting bitchy all of sudden,1
how do you girl feel about guy with number pack ab,1
why is it so normative for woman to make her so sleep on the couch,0
when am sweet to girl they think am crepe what do,1
men with temper issue how do you cope with having short temper,1
what is the nicest way can tell my boyfriend to either find some self confidence or m going to break up with him,0
married woman who did nt meet your spouse until later in life what wa your experience like,1
have you ever gotten bad vibe from friend so did you tell your friend were you ever proven right or wrong,0
how were you diagnosed with add adhd an adult,1
bos lady of reddit how do you connect with your colleague that work under you,0
lady who have had son ha having son changed the way you view male if so in what way,0
when at work how do you deal with sexist customer who think all your male coworkers are more qualified and just overall more important than you,1
have fantasy of reverse gangbang how can make it happen,1
you eat small shelled candy nerd m etc in the late afternoon that night you remove your bra and there a candy stuck to your boob do you eat it,0
men is it okay for girl to press themsves into you when hugging kissing,0
are woman romantically and sexually attracted to men essay long serious question from inexperienced nerd guy,0
if you had boat what hilarious name would you pick for it,1
what your favourite thing about being man,1
how did you become more socially successful overtime,0
felt something hard while wa fingering girl the other night what wa it,0
how do you pull off being an asshole while not alienating yourself from woman,1
best way to remove butt hair without shaving,1
what is it like sharing dorm room in college,1
lady how did you end up having fwb,0
what doe your perfect date night look like,1
what age range of woman do you find most attractive,1
what your biggest worry about woman sexual health that you ve always been too scared to ask about,0
couple of year ago wore suit and tie to an interview for an entrylevel position at home depot on the day of felt like million buck looking back however feel like looked like an as is it possible to overdress for an interview,1
what is the biggest fight you and your so have had,0
whats your opinion on chick asking men out,1
fellow men why do so many of you send unsolicited dick pic to woman in social apps,0
what country ha the bestlooking men and why,0
men of reddit in what order do you always towel down after shower,0
how many people have you slept with doe it bother you do you tell your potential partner even if you do nt have an std,0
woman of askmen what is the most interesting fact you ve learned from reading askmen,1
how would you like to be approached by another woman or how do you flirt with other woman,0
what the best way to tell your so how amazing they are,1
what do you think about herbivore men,0
how would you feel about used toy,1
what is you opinion about pickup seduction,1
what wa the moment that made you realize you wanted or had to end your relationship or marriage,1
you save centaur life after she almost choke on pretzel stick her life partner is sorcerer named fran who a show of gratitude grant you the ability to adopt one feature from the animal of your choice what animal and feature do you choose xpost askwomen,0
lady how do you measure your self worth,1
how creepy would you find it if girl you re seeing left you care package on your doorstep when you were nt feeling well,1
my fiancee told me she wo nt take my last name but she doe nt understand how important the unity of family is to me would you prefer your wife to take your last name,0
how do you feel about the woman soccer team getting equal pay what reason do you think it will wo nt happen,0
what the most creative complinsult or backhanded complement you have ever received,1
if you ve ever lived fully by yourself e no roommate did it ever make you lonely how did you manage it,1
long haired lady how the fuck do you work bobby pin seriously all these style are like secure with bobby pin and m like why must you mock me with useless instruction,1
why do older woman cut their hair shorter,0
should confront my misogynistic housemate,1
how do you protect the woman in your life,1
how do you men feel about spiderman possibly being out of the mcu,0
how do you feel about casual eye contact g while walking in the opposite direction someone,0
what your stuck my dick in crazy story,0
grill of reddit will you tell me about the juiciest piece of meat to ever be exposed to your redhot coal,1
why do yall like boob,1
who will you vote for in the number election,1
what is the worst case of creating your own problem that you ve seen,0
lovely long haired lady can you give yourself beard demand photo,0
straight men what would it take for you to get sucked off by another man,0
would you date member of european royal family how would you deal with the protocol and constant medium scrutiny,1
boyfriend what will you be doing with your girlfriend on valentine day,1
when wa the last time you laughed so hard that you cried,1
men who have been midshit when the fire alarm went off at work what did you do,0
what is wrongly labeled shallow by society,0
when wa moment when you felt genuinely proud of yourself,1
do you think lottery winner should be allowed to remain anonymous,0
why is our culture today so phony,0
lady doe manspreading really bother yall that much or is just vocal minority making it big deal,1
what are some good looking dick decoration or costume,1
what would nontoxic masculinity look like,0
how do you get when you go too long without masturbating,1
what something you wish your so kept doing after you both got married,0
what event derailed your life for several year,0
how do get my boyfriend to quit asking to play video game with me he bad at them and doe nt even like them,0
woman who found love later in life how did it happen,0
men how many of you have experienced the problem at the urinal where if another dude is at nearby urinal you can seem to piss until they leave,0
men do nt care about my orgasm,0
if you have ever been hostess at restaurant what were some thing you disliked about your job,1
what do wear on first date,1
what is your drinking behaviour how often how much and how do you act when youre drunk,0
for those of you who have tried the burger king impossible whopper what are your thought,0
serious widow here how do help my number yr old son become better man,1
what is your definition of an ideal girl,0
is bossy such bad word,1
what wine pair best with raw cookie dough,1
what is the mole hill you have chosen to die on,1
how to deal with best friend moving away,1
are men getting le manly masculine,0
have you ever slept with your so friend how did that turn out xpost from asktrollx,1
how long do usually wait to have sex in new relationship and why,1
great men of reddit what are your trick to live like king on budget,1
what is your favorite stare out the window of moving train and feel existential song,1
what should be asking my mother before she dy,1
what do we do with people who do nt accept die hard the greatest christmas film of all time,0
anyone that ha partner who is addicted to weed alcohol how do you deal with it ha anyone helped their so get out of it,1
what your favorite song from the number,0
which accent is the sexiest,0
if relationship would nt survive without sexit weak,0
what do you consider nagging and how do you deal with it,1
what one high paying job which you can get without having decade of experience,1
are there any tip on how to make friend with other woman especially when out of the work force,0
is girl who can drive turn on,1
how ha woman broken your brain with her appearance,0
have you noticed gender spilt on spotify discover weekly playlist if so why doe it exist,1
my girlfriend hate cheesy joke what your favourite one so can annoy her,1
how many men here have had threesome involving another man or would aspire to have one how do you think the reality compare to the fantasy,1
wealthy men of reddit what about being rich did you not expect,1
what the strangest thing you ve ever seen someone cry about,1
woman who have been pregnant what is the craziest most inappropriate thing someone said to you while you were pregnant,0
gay guy what is the straightest thing you have done with your buddy,0
how have you dealt with feeling unattractive and undesired by people,1
how often do you talk to and see friend,0
when wa the last time you cried,1
what wa decision or choice you judged didn understand until you went through it yourself,1
what is something about female body you find interesting or want to know more about,0
woman of reddit who do nt comment on post why do nt you,1
men of reddit what do you really look for in pizza,1
what your worst mansplaining story,1
what do you have in common with the other woman in your family what is something about you that is very different,1
is it normal to like blow job,1
what make man physically unattractive to you,1
what are the weird quirk of being man that woman never think about,1
introverted gal what connects with attracts you in man online dating profile,0
broke up with girlfriend of number month did do the right thing,0
doe it hurt to men when they get punched or kicked by girl or do you not feel it because your muscle playfully or with force,0
what do you feel about wearing girdle body shaper,0
what something you want but do nt ask for much because you do nt want to seem needy,0
how are you guy preparing for the storm,0
married men how did your first interaction with you so go,1
how do get vagina smell out of my couch,0
people who were seen average or unattractive in high school what wa your experience like and what it like now,0
askwomen can you sense bitterness in man,0
lady how did your life change when you meet the right person after having awful luck with dating,1
gentleman what message would you like to send the lady of reddit,1
what did female coworker say or do to you that would be considered inappropriate if role were reversed,1
how do you feel about cellulite,0
men of reddit that use dildo why,1
what is the minimum you do to look polished on typical day,0
how do stop thinking opening up make me weaker,0
men in long term relationship what little thing do you miss from your so from the honey moon phase,1
why do people rush into relationship,1
lady let talk assault rifle do you prefer accurate and portable like an number or do you go for reliable and rugged like an ak number,1
have you ever been tempted to do porn and why were you interested,0
how long would you wait for date to show up,0
single father of reddit what are some hardship you have to endure that people do nt seem to understand,1
men what wa your first love story like,1
what date started out well bad that reversed into horrible good,1
my dog vet is called cat what stupid shit like this make you laugh,0
is chivalry dead,0
why do nt you cuddle with your best friend,1
askwomen what do you look like right now,0
how many of you guy get turned off if girl tell everything to her friend,0
from woman point of view my boyfriend make me feel safe and secure in many way but want to know what do your girlfriend do or have done to make you feel safe,0
how often do you masturbate to thought of your ex,0
what are you doing tonight on july number th,1
gay men of reddit what genre of porn do you enjoy,0
what an experience that changed your life that no one want to hear about,0
how do you maximise your time in the evening after being at work,1
men what are the best brief that support and are also comfortable,0
if confidence is such big deal why do men insult,0
married woman how wa the dating relationship stage with your current partner different than your past relationship,1
what is your favorite part of your job work day,0
do you really think it is easier for woman to get laid do nt why do you think this,0
are you sometimes anxious that the men around you secretly believe in the red pill,0
what common advice given to woman from popular medium is actually terrible life advice in practice,0
what are some great cooking tip for someone in college you wish you knew earlier,1
what did miss out in boyhood m ftm trans looking to recreate my missed boyhood,0
this sound silly but doe anyone else here worry they might be infertile because you ve never become accidentally pregnant,1
story of intuition please share,1
what do you do when girl look at you and smile,1
what do woman do that make you say wtf,1
lot of woman do nt want to date men under number foot but how to men feel about woman number foot and over,1
what are some tell tale sign story with female lead is being written by man,0
how often have you been told to smile and how did it make you feel,1
m trans woman who spent the first number year of my life trying to overmasculinize myself to compensate for my insecurity what staple of girl childhood puberty and high school year did miss,1
how do you manage working full time job cooking cleaning and you physical mental health feel there is nt enough time or energy,0
what wa your most humiliating hook up experience,1
what do you think of stan lee death,0
have you ever felt insecure about your uneven breast how did you handle it,1
you wake up the king of the city you are currently at what do you do to ensure your and your family if you have one survival,0
former shy men how you get out of it,1
what in your pocket,0
what scream out fuckboy,1
manly men of askmen who do manly thing how do you make yourself feel pretty,1
lady that have gone solotravelling and decided to travel with stranger on trip what ha been your worst experience,1
which tv movie star were you crushing on when you were an adolescent,1
would you date trans woman under similar circumstance,1
what the kinkiest thing you own,1
woman making number figure annualy what is it you do,1
what kind of thing do you do to encourage your partner when they are going through stressful time at work,1
what are your favourite slow cooker recipe,1
is the term you guy offensive,0
what are some thing that are amazing when they re good but awful when they re bad,0
woman who made the personal choice to not date in high school why,0
why is reddit so antifat especially antifat woman,0
how do you feel about receiving something like postcard in the mail from friend or someone you like,1
in your experience how do the men in your life react when you open up emotionally or express strong emotion particularly with negative emotion like anger,1
you and the last person you had sex with have now swapped body how that working out for ya,1
what make you offer second date,1
why do ribbed condom taste nothing like rib,1
what career did you want to have when you were younger did you achieve this,0
what are some good ethical thing you do for more selfish reason,1
my roommate died how do cope,1
if you have cod liver oil which brand do you have have you seen any beneficial effect,1
what female character trope cliche irritate you the most,0
number year old riding his bike just slapped my butt i wa walking what the fuck would you have done,0
men of reddit how different doe it feel if you use condom,1
have you ever rekindled relationship after ghosting someone why did you ghost and how did thing work out,0
what the saddest story your parent ever told you about their life,0
did nt respond to his first move doe he think do nt like him,1
what if mother could choose between legallyenforced paternity support and the right to an abortion,0
what bad quality do you wish people would stop glorifying or rationalizing,0
lady what is surefire way for man to increase his sexual appeal,0
woman what are some of your horrible experience with tampon,1
woman who work out what workout do you do and how have they positively influenced your life,0
double standard the abdominal v the gap,1
how can stop being attracted to high school girl number here,1
how doe the person you ended up with compare to who you thought you end up with,0
what do you hate most about catcalling,1
what colour do you find most attractive on nail toenail,1
so my number girlfriend doctor refuse to install permanent birth control on her but ha no problem suggesting that number should get vasectomy instead thought,0
what is healthy self esteem and how do you get it,0
can we talk about the new flo commercial really quick,1
why ca nt listen to my wife,0
so honestly do any woman actually enjoy anal sex or do you do it to please men,1
how do you deal with guy mistaking your friendliness for flirting interest,1
what one thing you struggle with every day,1
those living with their girlfriend how often is the sex,1
why do guy care so much about their dick size,0
when you give someone head nod do you nod up or down,0
do woman really find pleasure in anal sex,0
when did you realize you were dating an idiot,1
men of reddit what is something you struggle with that woman don understand,1
how do you plan to fuck up your number before it begin,0
couple that have been together for number year what do you do to show you re still attracted to each other how do you show your love,1
what the strangest most interesting thing you ve stuck your dick into,0
what time do you usually eat dinner,1
how ha your opinion of your mother changed you ve gotten older,1
do you like it when the guy take charge,0
what do you like to talk about with stranger,0
what do you wish you did nt have to teach your so,1
older woman of reddit what kind of thing have you noticed happening with your body mind spirit you ve aged that no one told you about when you were younger,0
who do you consider to be the most attractive woman,0
what scream have big ck,1
just found out got number number on the psat how wa your humblebra mean week,0
anyone else piss in the sink,1
if you were no longer person but instead were basket of four secret ingredient on chopped what would you be,1
men of reddit what is your favorite movie and why is it mean girl,0
okay men of reddit how many of you actually wash their hand after using the bathroom,0
if your home c is nt blowing cold is it better to use the fan mode,1
dad of reddit what your advice for new father of baby girl,1
it monday and d like to ask how your day ha been today woman of reddit,0
to piggyback off of the what the rudest thing guy ha said to you post what the nicest thing guy ha said to you,0
in futurama the professor go from age number to number and remark that he then need fake id to rent ultra porn what do you think ultra porn would be like,1
why do we consider sex ultraimportant and some kind of ridiculous rite of passage,0
why is nt wgtow popular mgtow,1
men of reddit who claim to be ugly what make you believe that,0
what is the sexiest piece of clothing that you own,1
how did you stop feeling rushed into finding love or an so,0
