Questions,Male
my girlfriend died how did you deal with this,0
men how often do you open up to your other male friend about thing that bother you,1
why do bus go pshshshhttttt when they stop,1
girl like said to me when you call me insert name and you talk all buttoned up it hard to talk to you what doe that even mean,0
woman who had cosmetic surgery how ha your life changed for better or for worse,1
what something woman think men like but they actually do nt,0
woman of reddit how do you ask for raise,0
gay men of askmen how do you feel about boob,1
would you go after the nice girl or the interesting girl and why,1
men who ex left them for another woman how did you take it,1
bi lesbian woman have you ever developed feeling for your female best friend if so what did you do straight woman how would you react if your bi lesbian best friend told you about their feeling for you,1
how do you take criticism,0
do you think that sub depicting cartoon child abuse should be banned,1
is anyone else sort of the ugly friend how do you deal with it without being sad all the time,1
lady what the silliest thing you do with your so,0
why do you think that there are no girl on the internet is thing,0
how do men not just give up,0
what old tv show would you like turned into movie,0
what your opinion on going out braless,1
ve heard of guy thinking with their dick what your story of thinking with your pussy,0
in relationship that have stagnated how do you know when enough is enough or when you need to push to make thing work,1
would you consider having reddit based girlfriend and if so why,0
what song can play on guitar to serenade pretty girl,1
in your opinion is it inappropriate woman to not wear a bra why why not,0
what do you tell your hair stylist when he she asks so what are we doing today,0
am wrong for being mad,1
what do you enjoy and appreciate about men,1
so other than my mom which celebrity basically confirmed to you that you had entered puberty,1
what your most important everyday carry item,1
woman of reddit what is the funniest question of woman body from guy,1
instead of the worst or scariest what are some meh or soso date you ve been on,0
what mistake did you make early on in your career what would you tell someone first starting out,0
those in relationship with the opposite vert how do you make it work,1
what are your road trip pet peeve,1
what always the worst during your period,1
arousal girl how easily can you get turned on by seeing hot guy hot to you weather in movie video picture or in real life without knowing him on personal level,0
what your favorite eye color hair color combination on guy or any person,1
lady what something you ve been dying to humblebrag about,1
what that one person from your past you want to get into contact with,0
how do you feel about the use of the word guy to address group that includes you,1
when do you say love you to your so,0
what is trait you have that help you advance in your career,1
ha online dating affected your ego selfimage if so how,1
how do you use your down vote on reddit,1
woman who had kid how doe pregnancy and labor feel like,0
what characteristic should we aspire to men,1
people who have considered themselves wasted potential at one point in life what have you done to get past this feeling,1
how many of you have dream that you know you probably wo nt muster up the courage to fulfil,1
when something in your life feel off but you ca nt put your finger on what it is what do you do,0
dear woman who considered ending it all for good what are some moment you re glad you got to live and be part of,1
how exactly doe one dress their age,0
lot of celebrity getting fired for sexual allegation yet our president still hold office thought,0
what is an actually good movie that too often get dismissed a chick flick,0
how do you lower your standard when it come to dating,0
what is harsh truth most of askmen refuse to accept,0
which brand of lipstick do you like the most,1
woman that get rid of pubic hair how do you keep the area free of ingrown hair acne what your routine,0
what is honestly the best toothpaste to use,0
what sexual thing is really overrated,0
how to create instead of just consuming,0
would you want vagina dentata if it wa possible,1
what are some smallish way your treat yourself,0
guy my sister said french tip nail are boring fuck and she prefers acrylic nail what nail do you prefer on girl you re interested in,0
when did you start prefering to stay in and sleep relax rather than go out,0
what is something small random you like to accomplish experience before you die,0
wellgroomed men of reddit what your daily routine for better skin and to smell good,0
what are the unspoken rule of the girl bathroom,0
how do you feel about girl who enjoy receiving oral sex,0
men of reddit how do you keep conversation fresh with girlfriend,0
men of reddit how do you feel about the guy girl,0
what amsterdam like in term of the drug scene and red light district,1
how accurate do you think the expression when you meet the right person you just know,0
my gf got sent dick pic by guy who like her and know we re dating but begged me not to do anything what are your thought what would you do,0
all woman who play video game what is your favorite game to play with your boyfriend,1
is it normal to give your partner space after huge argument how much time is normal,1
if you could instantly master become an expert in one skill what skill would you choose,1
to those with so that work long hour and come home tired regularly what can they do to reassure you they love you,1
have you ever been pursued romantically by teacher how did you react,1
what is the most creative complisult or backhanded complement you have ever received,1
street smart woman what are your tip to keep yourself safe,1
do you have lot of friend that you trust or just few are they mostly woman or men and how do you decide to trust them with your friendship or do you keep them at arm length,0
how do you keep yourself you in longterm relationship,1
at what age did you meet partner that made you believe another human being can be trustworthy partner in life,0
woman who have gotten their tube tied what wa your experience how old were you side effect,1
how many of you have accidentally shat at the urinal,1
woman of reddit what wa your biggest omg im making move on you moment,1
lady of reddit it that time of year when the leaf are turning the temperature is dropping and darkness is creeping earlier and earlier let gather together and give it our best shot to raise the hair on the back of each others neck what are your true spooky story,1
is guy being tall an automatic turn on for you,0
just cancelled second date because of his height ha anyone else turned down guy for similar reason what wa the reason,0
what is your minimum criterion for someone to be considered freak in bed,0
what kind of gun do you gal own,1
what been damaging your self esteem lately,0
how late in the semester is generally too late to sit next to someone new,0
how would you feel if you found out your so chose bulbasaur their starting pokemon,0
so do nt drink smoke or do drug is that weird,0
when should you tell date about your child ren from previous marriage,1
reminder any dae yes no is this normal question will be removed,0
what is your try on nightmare story,0
what the best thing you ve said to stop unsolicited dollar pic,1
what change did you make this year that had the biggest positive impact on your life,0
redditors who have completely start over in their late number what did you do how ha your life changed,1
what your had to step in and put an end to another guy flirting messaging asking out your so story,0
what unexpected struggle did you go through in your twenty and how did you overcome them,0
let be honest why are you not good catch,1
what something you re normally complimented on versus what you wish more people would notice about you,1
what wa your biggest achievement so far in life and how did you get there,0
ve got list of sexual thing my boyfriend like that really do nt get m wondering what men here think,0
what do you do when you feel isolated serious,1
how do you get the confidence to travel on your own if your friend ca nt join you and you do nt have an so,0
what are some supply you need to get,0
what car do you drive,0
men who are quiet during sex what are you thinking of and why aren you vocal,1
final update potential employer made sexual joke during our emailing back and forth bad sign,1
woman with male roommate how do you find them,0
lady who like having weight on them what your height and happy weight,1
best reply when girl say have boyfriend and you were nt trying to game,1
askmen what would you think do if you knew you had some woman feeling like bitch in heat over you,0
married men of reddit what are little thing you do to make your marriage better,0
why do enjoy mowing the lawn so much,0
is there anything sexier than fit girl back,1
what tip trick do you recommend to prevent or hide arm pit sweat showing through your clothes,0
why are only overweight woman outspoken and or aggressive on dating site,1
roll tide,0
what house rule go straight out the window when your so is away for week,1
woman who have been pregnant did you have your placenta encapsulated or made into another product for your later use tell me about it,1
men what are your experience dating those disney girl,1
what is the movie that taught you the biggest lesson about being man,0
were you surprised at how much broken heart actually hurt,0
am an overweight man about number lb who is actively trying to lose weight would you consider dating me or should lose more weight before asking girl out,1
my husband pee while sitting down how common is that,0
men who browse askwomen in what way ha your view of woman changed,0
single woman who want relationship but never found anyone how do you cope up with loneliness,0
how doe one stop feeling threatened physically by woman,0
what is your biggest sexual fantasy realistic or not,1
what your favourite anime,0
update my car battery died so walked to the nearest tire place and the most beautiful guy came to help me jump it he told me to come get the new tire that desperately need tomorrow how should make the first move,1
mean really how innocent is porn,1
in retro perspective what one of the biggest mistake you made which other men should avoid,0
what the appropriate amount of time to wait before eating someone on desert island,1
woman who are the reason for your and your partner dead bedroom db whats your side of the story,0
men of askwomen what is the most interesting fact you ve learned from reading askwomen,1
people who so have cheated on them how did you find out and how did you react upon finding out,0
what is the best funniest compliment you received from guy,0
how many of you grow beard for yourself grow then for others and why,1
how long did you last the first time you had sex,1
how do you feel about girl that cook for you the morning after you stay over,0
what are some simple thing we can do in our everyday life to be better people,1
m very modest traditional moral girl doe what m looking for in man exist,1
what ha your biggest aha moment been in therapy,1
when is gender inequality first noticed in child and in what way,1
how doe it feel to be loved,0
mother of reddit what one thing you wish you had known before you had kid,1
what the point of other candy bar if we already have snicker,1
what is the difference between woman saying she want man of certain height and man saying he want woman of certain figure,1
what your favorite outfit clothes style to see on woman,1
wtf is with this new cuck movement,0
how do you manage stress,1
would like to ask out waitress how can this be achieved without coming across a creep,1
what item of clothing should be eliminated from all men wardrobe,1
okay be honest how often do you get bored of your hair and need to do something new,0
what are your favorite way to celebrate small victory,0
in having depression what doe bad day week or month look like for you and how do you improve or have le of these occurrence,0
how important are nude to you in relationship,0
what make you want to scream into an empty bag of doritos right now,1
men of askmen what are your thought on twoxchromosones being included a default sub with no comparable subreddit involving men issue,0
lady what ha been the longest amount of time you had gone without sex,1
those who have done food sensitivity testing how wa it and how accurate wa it,1
woman who ve lived in multiple culture where dating sex love wa treated differently what have your experience been like,0
how have askmen helped you,1
how real are stereotype about penis size,1
what name do you really love but would absolutely never name your child,1
would you wear with charcoal suit jacket black or gray shirt and what would the color of the tie be,1
older men how do accept that m probably going to live an average maybe slightly boring life,1
how do you make female friend without having hobby,0
what wa your experience with laser stretch mark removal,1
so have number month old and every morning before go to work she look up to give me kiss goodbye and it got me wondering at what age is it considered weird to hug kiss your kid,0
what the harshest thing you ve ever said to significant other do you regret it,1
when wa the first time you said something someone wa cute,0
how did you overcome your first big heartbreak,0
m absolutely terrified of pregnancy and giving birth what is it like what make it worth it,1
woman who got along with their mother well in the dread teenage year what did your mom do to be incredible and to make you not despise her pregnant with girl and for some reason terrified,0
how do you feel about your boyfriend giving you rose,0
wedding planner what should couple know have and or do before they engage your service,0
update from the number year old who found out that she ca nt get pregnant and wo nt have period anymore lady and gentleman,1
man in relationship of over number year ve often found that a the guy you re expected to automatically be happy or at the very least completely emotionally stable in any situation is this common in healthy relationship and if not what seemed to help ease it,1
if random man had to spend the next year of his life a woman what do you think would be the most surprising thing to him,0
am guy number and am wondering how do know if another guy is also gay without asking him directly,0
what are your thought on gay porn,1
how would you respond if another man said to you you really hurt my feeling,0
woman of reddit who were invited to someone place for sexy time after night out you walked in and realized right away you made the right wrong decision what did you see that made you comfortable or made you run out or question what you were doing,0
why is having knife collection seen weird,1
what are you tired of explaining to woman,1
how do pet influence your dating,1
how do men feel if girl face doesn match her body,1
how do you keep yourself from getting in over your head with hookup new person,1
what are some grooming hygiene beauty tip that you had to pick up on an adult that seem obvious to others,0
why do so many woman think it ok to criticize what another woman is wearing,1
why is there stigma with girl asking guy out on date if you believe that stigma still exists up to this day,0
you re watching your wife deliver when all of sudden an egg roll out of her and hatch into baby dragon what your reaction and why,1
what is the coolest guy stuff that can buy on amazon for dollar number,0
where in the world have you felt the most unsafe and why,0
do you feel like woman have incredibly fragile ego,0
what something other than rolled up sleeve that make man outfit attractive,1
if you had to how would you describe your nothing thought,0
what is your opinion on guy who say they be nothing or would nt be half the man they are if it wa nt for their girlfriend,1
men if you had number hour left to live what would you do with that time,1
what is the most influential book you have read that empowers woman,0
what do you think of sexually submissive men,0
if society did nt demonize men so much sexual predator would you hang around child more often,1
controversal woman who get offended by other woman breastfeeding picture public etc why,1
why do so many girl think that if guy want sex that mean he only want sex and nothing more,1
what do woman do that make them attractive to you,1
do you expect man to prioritize your orgasm,1
what is it about older men that attracts woman,0
whoever thought they broke up with the one and found someone better how did that process happen for you,1
guy with ultracompetent and highly capable partner what the one single area where they re completely useless,0
fellow men what is your strangest nut shot experience,1
what is the best pickup line you ve heard that did nt work,0
just ate whole box of mac and cheese for breakfast what shameful thing have you done this week that you are nt ashamed of,1
what do you say to man who think that giving compliment to his so and doing anything romantic is unmasculine,1
how you go about picking your current hobby,0
ha anyone ever stuck it out with someone who wasn ready for relationship why or why not,0
how badly do you think porn addiction is problem for young male,0
woman who started their relationship the other woman doe it ever cross your mind that your partner will find another other woman when committed to you how do you stop your mind from wandering,0
what is something illegal you thought wa legal,1
how to deal with friend who ignore you but not another,1
nudity in couple how much when,0
have you ever done staycation where you booked hotel in your own city and spent night weekend there alone just to recharge and get away how wa it,0
how woukd you perceive someone plyaing guitar on busy bar street in college town,0
have you ever weighed yourself pre and post shit what wa your biggest shit,1
how to look feel put together when your mental health isn great,0
what the advice you wish your father gave to you before moving out,0
what is small thing you do every day that help you remain positive,1
lady of reddit those of you who have particapated in anal sex how doe it feel how do you prepeare for it mentally and physically,0
what a good hobby that result in an endproduct,1
when did you realize you were funny and how do you think having good sense of humor ha helped you in your life,1
do unattractive woman really feel completely ignored invisible,0
have any of you worn short midlength skirt without shaving leg,0
sup dude did nt grow up with father figure and have nt really learned on my own what are some tip you would give to your male son about the hygiene,1
why is it so common for woman to say that they do nt get along with other woman,0
what something harmless you take really personally when you probably should nt,1
at what age did you have your first drink,1
how do you avoid seeming or feeling like pedophile when talking to kid in public,1
what baby fever like for men,1
at what age did people stop calling you boy,0
what are your side hustle to make extra money,1
what doe it feel like to have girl love you,0
are you more attracted to men who wear bright color any specific one,0
what are some sign that you might overlook when you should leave relationship,0
single of askmen besides friendly handshake or family hug what the most physical contact you ve had this year,0
man abuse an issue people should focus on same for woman and child abuse,1
what do you think make guy loser,0
what have you been shamed for only by men,1
who more attractive woman or men why,1
are girl actually that horny,0
men of reddit how often do you miss being in relationship,1
gentleman how fluid is your sexual orientation,0
which country ha thr best food in your opinion,1
which animal would cause the most mayhem for human being if they were obtain our intelligence,0
experience of woman using sex to control men,0
how do make my grandfather feel better about being gay,0
do you have problem with kissing right after oral sex,1
woman with pmdd what doe it feel like to have pmdd,0
what is reason you turned down sex,0
woman what do you think is the equivalent of red pilled guy but for woman,0
where do you get your hijab from,1
what are some way men are treated in society that apall you,0
what make you think that we want you,0
woman who were mean girl teenager what thing could your parent have done to prevent you from becoming mean girl,1
have you ever been late bloomer first girlfriend how did it work out,0
what make good manager,1
what are the do and donts of staying friend with an ex from your personal experience,1
what career certification helped you the most and how difficult are they to attain,0
how many of you lady have not cheated and how many relationship have you been in,1
just number month left for number gon na be another resolution time which resolution that you made for number are you still going strong on how did you manage mon tell your humble brag,0
fellow men am the only one who like woman that do nt wear makeup better,0
what is your spirit animal why,1
married woman of reddit how old are you and how many boyfriend partner did you have before marriage,0
how do you deal with men being creep,0
lady doe it ever get tiring having to dress up make up keep your body up etc,1
mother how do you deal with this generation seemingly premature access to the internet esp youtube what do you do to protect them from harmful content,1
how do you deal with nice people who show romantic sexual interest in you but you do nt them,0
men why is there so many dick drawn all over the place,0
pornwatchers what do you like about the porn you watch,0
what would reddit be like if number of the admins mod and user were woman or genderqueer folk,0
what are some mundane thing you enjoy about your life,1
when looking at used car what are some red flag indicating you should nt buy the car,0
what percentage of woman would you say you are attracted to,1
what are your thought and prayer about the new beauty beast movie fron feminist perspective,0
what is the weirdest thing you ve said or done to someone you had crush on,1
what popular fashion trend have you tried that really did you dirty,1
how do you feel when your so smack your as,0
yesterday asked thread asking where you guy saw yourself in five year and good number of the reply said dead how prevalent do you think mental health disorder are among the men in your life and what are some step we can take a culture to improve this,0
what are the nsfw subreddits that are really worthy not based on sexual excitation but for body positivity,1
antifeminist of askwomen why are you against feminism feminist of askwomen why are you against antifeminism,1
have you been creep to someone when did you realize it,0
lady why do you initiate texting with guy but never ask question back to keep the conversation going,0
f inally found the man want to spend the rest of my life with but there one thing,1
to follow up on the worst concert you ve ever been to post what is the best concert you ve ever been to,0
on tumblr ve seen it claimed that men on subway will open their leg to intimidate woman is this real thing,0
what the dumbest rule your parent had while growing up,1
what are the beauty standard in your country,0
true or false the prettier woman is the longer you re willing to date her while waiting for sex,0
wa your so there for the futon and instant noodle how did she support you if so how do you express your gratitude now that thing are better,0
what were the most important thing you learned in your number,1
what the creepiest thing that happened to you involving guy,0
what doe healthy relationship look like how doe it feel what behaviour doe it include,0
if you could pick one question to be permanently banned to be asked on askwomen which one would it be and why,0
how wrong is it to masturbate to porn when you have girlfriend,0
what is something that you wish more people cared about,1
lady of reddit what do you think of the new ghostbusters movie,0
what your favourite cheese and what do you like to pair it with,0
woman of reddit why do you drink alcohol,0
my ex girlfriend once asked me if would still love and have sex with her if she would be horse she wa mad for week or so when said no after long discussion what are your weirdest question ever asked to you,0
what bro science do you swear by,1
what are some telltale sign your partner respect and care for you in your relationship and what are some false sign,1
lady who are nt into hookup culture where do you find men that want something serious,0
ve been struggling how do you deal with being insecure envious towards another woman,0
men of reddit what is the most dangerous situation you ve been in and why,0
in charlottesville the police refused to protect synagogue next to which armed neonazis were marching and making threat do you think the police should have protected those at the synagogue why or why not,1
wcw or wwf,1
have you ever regretted having sex with someone and why,1
why are so many question here downvoted,1
whats the most disgusting thing man ha ever done or said to you,1
how do you feel about being the having momfriend,0
would you guy consider it red flag if guy is not on social medium,1
ve heard over and over that when man notice and comment on your new haircut it a sign of interest is there any truth to this,1
what do you wish you had discussed with your so before you dated them or married them,0
