Questions,Male
how to fix an asymmetrical face,1
what you least favorite household chore,0
why bother committing if you are constantly looking,0
straight men under what circumstance would you be most likely to accept blowjob from another man,1
what do you look for in girl necromancywise,1
what are the worst job experience you ve ever had,1
what doe looking professional mean to you,0
my girlfriend number and m number are talking about baby name we think we could eventually get married how nut are we,0
what cute thing do you want to see the most,0
break down yourself into data set height weight iq band size age etc which two data set would you exchange if you could and why,0
introverted lady of reddit how did you get through your wedding event shower ceremony reception and make sure you enjoyed yourself,1
how do you deal with random bout of depression,1
what wa the most ridiculous instance of someone asking if you really knew about the band on your shirt,0
if you could summarize your personality or an aspect of your personality using metaphor what would that be,1
do men actually not want lady with half brain on their head,1
what do you think is the leading cause of men deciding to end their own life and what can be done about it,1
what is with all the picture request,1
gay guy here how do get woman to stop hitting on me,0
my band won dollar number in battle of the band contest tonight what awesome accomplishment of yours do you want to share,0
would you date someone who identifies an egalitarian,0
men how have you dealt with the trauma of enduring an unwanted kiss as slap or other similar type of sexual assault,1
guy with lot of female friend how,0
my friend told me wa asshole for ending the date with woman because didn met her requirement to have sexual relationship with her how do persuaded my friend that what did wa right for me,0
what is your very mild super power,1
other than distance what ha caused you to deliberately end friendship,0
nonamerican men what do you generally think of american woman,1
dad of daughter how ha having daughter impacted you changed your perspective of the female mind etc,0
what strange rule your household had while growing up that you have a hard time breaking even now when you re an adult,1
at work how do you ask someone nicely to do task themselves when they re trying to offload it on to you when they could and should do it themselves,0
how can woman be better advocate and more supportive of men mental health,0
what is one childhood story event your family always tell about you,0
am an ahole for saying this,1
when going to bed do you kiss your partner or say goodnight,1
my girlfriend hate taylor swift how ha your so been massive disappointment,0
why is closure so important,1
what made you fall in love with your o and how long did it take,0
how do you get over insecurity about your gender or height particularly in male dominated field,1
how doe it feel to know that there are pornstars out there that look like you,1
woman who chose to not have an epidural during their pregnancy birth how bad wa it,0
so uhhhh what the appeal of pegging m guy who ha only heard of it enlighten me please,0
what did you feel after being cheated on,0
what a not gay way to ask him to go camping,0
older woman of reddit what issue do you see with the younger generation of woman in today society,1
what your rock bottom story,1
what the dumbest thing you ve done in the name of beauty,1
what is some of the best weirdest backhanded complement you have received,1
what is the best way to support guy who is going through depression,1
what ha been your biggest argument with your so or recent so what wa it about and how wa it resolved,1
guy what the number thing that make you happy that you re male,1
what the most annoying womandepictiontrope in medium,1
how do you feel about france winning the number world cup,0
cheated and feel like crap not sure how to tell my girlfriend,1
what is your favorite picture of your pet,0
how do you deal with or process microaggressions,1
are bjs must,0
it international transgender day of visibility who are your favorite trans or gender diverse character,0
what do you consider when shopping for engagement ring,0
what if any animated male character do you find sexually attractive,1
what are some way you break the touch barrier to show woman you re interested,0
ripped guy how do you stay so shredded,0
m uncomfortable with escalating thing physically with girl unless she make it extremely clear that she want to how can get over this,1
woman of reddit who stopped shaving how long did it take you to get accustomed to it did you get any negative reaction,0
male gamers of reddit who played team fortress number in the past how did you react when you found out that the sniper routinely blow his load inside the scout alluring asshole,0
what the worst wellinentend romantic gesture so ever did for you,0
what song would you masturbate to,0
what your most memorable fart,1
what is your favorite meal to cook,1
what one thing you ve learned about woman that ha saved you lot of stress,0
what something you thought would be sexy but in practice wa an immediate turnoff,0
lady of reddit who live or have led double life how wa it for you what made you live double life,0
woman who often have people over what tip do you have to make your place more inviting,1
woman of reddit what are your worst hangover experience,1
tall men of reddit with large bath tub what is it like to finally fit your whole body underwater,0
men why do you watch porn,0
what big in the west but not in the east,1
adopted lost girl of china what wa your experience like growing up,0
what unrealistic expectation do young men have about woman,0
do nt upvote just needing some opinion from men involving scenario of hotel sharing with girl,1
how do you feel about men who preface statement on nongendered thing with a guy,1
guy who were the best men in wedding who didnt have date did it feel awkward or anything how did you handle the situation,1
how did you or your so first say love you how did it go,0
men who hated themselves and now do nt what changed what did you do to stop hating yourself,0
do australian have internet and why,1
when wa time where you thought the worse they can say is no and you were completely wrong,1
would you be angry at your husband if you asked him to decorate just one room in your new house and gave him dollar number to do so and he bought number oil painting of super hero,0
what do woman do that men would never think about,1
people always say pick partner with flaw you can deal with what your partner flaw you deal with and why is it something you are willing to look past,0
what is the most food you ve eaten in one sitting,0
what are some simple tip and trick to get make getting ready in the morning go little faster easier,1
how often do you have trouble telling apart someone just being friendly with you and someone showing interest in you,1
how long should you wait after meeting girl to ask her out,1
what are your thought on experience with brca and or other genetic variant test,1
student who developed good study habit later in life when they previously had bad habit or none at all what did you do do you still have trouble or are worried you ll slip back,0
girl ve been hanging out with just got out of long relationship what do do,0
lady what do you think about lingerie for men not men wearing woman clothes but satin lace underwear made for men,1
what do you expect from your partner that you ca nt tell them,1
what do you secretly judge other men for doing or saying,0
young woman please be honest doe twenty year old guy with almost full gray hair turn you off so much that you would nt date him,1
why do woman spray perfume on their wrist to try it,1
how do you deal with lingering thought feeling you thought were long gone,1
mother of reddit were you ever worried about loss of identity associated with having kid how did you overcome this,0
how doe smoking cigarette prevent hangover,0
just found out have no path to graduating high school this year what do,0
your pet ha business trip over the weekend what human care instruction do they leave for you,1
do nt upvote how do you pronounce clitoral,1
how did you move on while still living in the same city where something happened,1
what are the best way of dealing with rejection,0
woman raised by single father what wa it like growing up,0
what is your love language,1
what do your breakdown really look like,0
lady how wa your first sexual experience,0
men of reddit who have yet to pleasure themselves using coconut what are you waiting for,1
men with fitbits or equivalent how many step doe beating off give you,0
why are there so many irrational comment about height let have levelheaded and reasonable discussion without all the emotion,0
what are some book that helped you become better writer or reader and just generally more intelligent,0
when the time came how did you explain to your own kid where baby come from when finally asked you,1
how did you know when your bestie became your bestie,0
lady what is your worst why do nt you get man to do that for you story,0
how do you guy deal with touch starvation are there any way to simulate hug,1
men who have dated an identical twin what wa it like,0
what one thing never cease to amaze you about your so,0
will small dick satisfy you,1
guy who watch camgirls what is the point,1
how do you all feel about jetpacking ie being big spoon the smaller partner,1
what nsfw female lifestyle hack can you share,1
what wa it like when you first moved in with your so spouse,0
hello lady how do you woman feel about lockheed martin f number air superiority fighter aircraft,0
what make woman look or feel elegant expensive in your eye,1
guy do you ever feel uncomfortably sexualised if so how often more common from men or woman,1
being short and dating it making me bitter to woman,1
recently had male roommate speculate that the concept of female modesty stemmed from woman jealousy toward other woman what is the closest you ve ever come to telling someone to check your privilege or something similar,1
how many girl did you or can you really bang in college,1
how do you enjoy sex when you re not attractive,0
woman who have super heavy period how do you deal with it,1
what the fastest time you ve hooked up with someone you just met,0
what the worst example know men anatomy you ve seen,0
on scale of ca nt name single item of clothing you ve worn to you ve worn those blue pant number day in row how much do you actually notice what your female coworkers wear,0
when you brush your teeth do you squeeze the toothpaste tube from the bottom or the middle,0
how did you or someone you know become attractive in way that did nt involve losing weight,1
what do you do to make yourself feel beautiful,1
what wa the largest thing you ve carried in your purse,0
what you opinion on the number of the men get number percent of the woman theory,0
who would win in physical fight you or your so,0
some men carry lighter some men carry pocket knife some men carry flashlight etc what is your one pocket friendly tool you just never leave your house without,1
what box are you looking to tick on first date,1
how would noticeable weight gain due to poor diet and no exercise by so affect your desire in the bedroom,0
extroverted woman who married introverted men doe it work what your story,1
how do you maintain healthy relationship,1
how do make my relationship monogamous again it became very complicated,0
what do you think is tacky to have at wedding,0
people with mental health issue what are your promising moment for better life,1
in your experience what doe kink friendly mean in man online dating profile,0
what are the worst instance of female privilege that you ve ever seen,1
the have never thread post parent comment of something you ve genuinely never done denizen of askwomen who have done said deed reply with your story,0
my friend got gf but she changing him he make fun of me now because don have gf and don enjoy his company anymore what do do,1
men of reddit do you actually believe this bullshit,1
yesterday biracial thread scared me bit a white guy who will probably marry an asian woman were there any positive to growing up biracial,1
short men of reddit how do you cope,0
my penis doe not get erect without porn or friend family photo what is the solution,1
lady is singing an attractive quality in male,1
sex worker are there any client of yours you ve become genuine friend with,0
are you uncomfortable seeing other men cry if yes why,1
what romantic story are actually quite disturbing if you really think about it,1
have you ever been creeped out by somebody you were attracted to what happened,1
what it like to be an unattractive lady,1
what is something you wish men did more of during sex,1
poor working class woman what are some thing your middle class upper etc friend or family just do not understand,1
can you recommend good book that doe nt have straight white person it main character,0
what doe being good wife mean to you,0
woman who practice abstinence until marriage how do you deal with your urge,1
hey men do nt think you get enough credit for your lovely physique here are the observation of twenty year old lady,1
lena dunham think that the extinction of white men would lead to the evolution of better men just saw this in the news what do you think,0
what can we a hackerspace do against sexism,1
so guy what your favourite action movie and why is it road house,0
doe anyone on askwomen like sport,0
for which celebrity do you have crush,1
what the best man advice your dad ever gave you,0
what is your choice for cigar,0
m number year old to the older woman out there what advice would you give the number yearold you,1
what percentage of guy do you think would experiment with other guy if they were drunk,1
what should you tell to yourself if you feel down because you will never be with your celebrity crush,0
when you cuddle at night when you seem to be asleep is it because you re actually awake or doe it just happen,1
what are some dating myth you ve found that some guy tend to believe,0
what is your worst dating fail,1
my kid told me he found his mom vibrator how do leverage this information in my favor,1
gent is it wrong to not want kid while spending my number number traveling and shagging different woman,0
why are most sex worker female and most client male,1
what are some love coupon that you would like to receive,0
askmen battle royale right now,0
how much is body hair turnoff,1
my boyfriend is sleeping next to me should wake him up with blowjob,1
at what point in relationship did you ask to see your partner finance,0
men who have been divorced what advice would you give to other men to not make the same mistake,0
what funny quirky answer can say when asked what my secret flaw,1
how do you differentiate between someone being friendly and someone being interested in you,0
girl who are generally unenthusiastic low energy how do friend partner ever dislike it how do you deal with it,1
how would you feel if you found out your wife girlfriend wa having lesbian affair,1
what wa the most important lesson you ve learned from heartbreak,1
m bitter that didn go to prom with guy in high school what event in the real world function like prom for adult,1
what do you find completely frustrating and unbelievable about being woman in number,0
what your favorite part of your so body besides the obvious,1
in your opinion what should be the punishment of crime of rape why,1
how frequently do you give your partner grief for occasionally not being interested in sex,1
what do you like about being in relationship,1
what it like having finger in the butt while getting head,1
dad of reddit am expecting my son to be born today what is something you wish you knew before your first child wa born,0
married men of reddit what wa the first thing that came to mind when your wife walked down the aisle during your wedding ceremony,1
if you could design your own society what would your perfect utopia be like,1
nsfw what wa your first thought when touching fingering vagina for the first time,1
what the most memorable coolest way girl ha asked you out,0
woman who work for company with liberal wfh policy how often are you in your office if you do nt absolutely need to be,0
what is book that ha shaped you into the woman you are today,0
what is your sexual orientation,0
question on monogomy,1
men of reddit how did you learn to go out and enjoy thing by yourself,0
what the ideal marrying age in your country,1
those that have tried foria how wa it is it really the holy grail,0
those of you who enjoy gaming what have you been playing lately,0
do you think thin priviledge is thing,0
those of you that had weak handshake moment how did or would you recover,0
fucked up and now she wont leave me alone number,0
what made you finally commit to woman when previously you did not want to commit,0
ha anyone here had crush on ghost before there is real cutie down the hall and am at loss,1
men who gave brojob what is your lifestory,0
dad with preteen and teen kid what are your opinion on the gardasil vaccine,0
woman who still like chris brown why do you still like him,0
what is the worst rudest way you ve been rejected,1
how do you feel about gender reveal party for baby,0
once pulled knife on guy to get him to back off me what the craziest thing you ve done after saying no did nt work,1
woman who used to be antifeminist notprowoman what changed your point of view,0
what can number do to be good older brother for my number year old sister,0
men who found love after giving up on the idea of ever finding someone what your story,0
what should being in love make you feel,0
what your morning evening routine,1
how many men actually have or want gaming room,1
do you find shy guy creepy,1
what weird about your body,0
anthony bourdain famous american celebrity chef author and television personality just passed away what are your thought on this,0
if you were forced to eat fast food for your every meal what would be your top two place,0
if you ever lived your life in autopilot mode for while what came out of it,0
what female coded experience memory from your childhood or teenage year do you wish trans woman who transitioned later in life could experience,1
what female character in tv or film is obviously male fantasy,1
why do you think some people are so against socialism when it would help so many people and may actually make people happier,1
what are your best period hack,0
how do you cope in ldr,0
croatian men of reddit what type of woman interest you,0
men of reddit what is this one song that reminds you of your youth childhood,0
nsfw what sexual secret are you keeping or will keep from your partner if you have one,0
you find out you have number hour to live how would you tell your friend that you love her something that you otherwise could never tell her,0
when did you stop caring about excelling at your specific job within company,1
feministconscious woman what dream and wish do you have that you question or dismiss archaic tradition conditioned gender role,1
what did you think of the handmaid tale,1
how sexy do you dress on an everyday basis,1
what kind of secret society would you like to start,0
how many of you find emotional intimacy or expressing emotion difficult,1
woman in open relationship how exactly doe it work,1
pokemon come out today so what your favorite pokemon and why,1
what is something you hide to not be laughed at,0
men who just straight said to girl like you and would like to go out with you what conclusion and what happened afterward,1
how come my sexual stamen is so unpredictable,0
what a time where you followed your gut but wa wrong,1
glass wearing lady are nt christmas light viewed without your glass one of the prettiest thing ever,0
doe your ball sack shrink up like it cold when you sneeze nsfw,0
men just found out can no longer drive alcohol due to health reason what can order at the bar other than water and soda,0
an irish mother an english father and newborn baby girl number day old with no name what would you call her,1
have you ever received death threat or rape threat what happened,1
what would you do if you found out number number truly wa an inside job,0
woman who recently wa sexually assaulted how can reject other guy without making a big deal,0
told my wife wa going to quit taking her on date buying her nonessential eg makeup letting her go out to eat etc until she get job and she started cry is that emotional manipulation,0
father of teenage boy how similar were you a teen to how your kid is now,0
what are thing that men do that show they are insecure in their masculinity in your mind,0
what do you think is the worst part of having an oppositesex best friend,0
straight men of askmen what is the least amount of money you would accept in order to give someone bj,1
what doe taking care of yourself mean to you,0
number male hiring hooker,0
have you seen what anyone from askwomen look like how super duper smexy are they,0
what is that perfume that smell like cotton candy,0
number poor male keep getting made fun of by rich kid in my classic what do do,0
fellow airman next to me is arguing with restaurant waiter because he think their veteran day complimentary meal is nt big enough what the most embarrassing behavior you ve seen from coworker,0
black male do you ever get tired of people claiming that racism in the s affect all race equally,1
what would misconception about female sexuality would you want to clear up for teen girl,0
announcement there will be no more woman of askmen titled post,1
lady is cannibalism dealbreaker,1
what have you bought for under dollar number that changed your life or at least made something heck of lot easier,1
what doe the future is female mean to you,1
what are your thought on the stereotype woman take hour to get ready,0
what nsfw thing do you do when you are alone at home,1
even though it is treated feminine do any other men have craving or do we call it something else,0
at what age are you actually not kid anymore,0
what are the blatant sexist misogynistic issue that woman face on daily regular basis,0
lady why did you delete instagram,1
how did your daily routine change after moving in with your so,1
is confidence overrated,1
hopping off the back of another post those who where mean girl in school what are thing like now,0
what the lamest thing you ever did to get crush to notice you,1
what do other people do that make you feel good about yourself,1
what is your home from work and comfortable but also presentable enough to go outside again outfit,0
what fictional couple were actually horrible together even though they were written to be happy together why,1
what are example of small thing you ve set up in your daily life that make your life smoother easier or save you time energy,1
what the fuck are you supposed to do when you walk past woman alone at night to let her know you re not murderer,0
is there way we can make people see femininity awesome masculinity is,0
change in your view of the gay,1
we are often criticized for showing emotion so let it out what the silliest most trivial thing that made you cry,1
what wa the wildest thing you found out about your parent,0
doe the upvote icon today make you feel strange when you upvote,0
just walked out of my third we ll employ you to buy our product and sell it to other people interview they were super sneaky this time and waited until the end to tell me the position men what do and do nt do you keep in mind for finding job,1
what quality do woman look for in man that men may not be aware of,0
when did you realize you were nt with it and that they had changed what it wa and it seemed weird and scary to you,1
those who have had an encounter with the paranromal what wa it like,1
guy would you date have sex with date younger girl say number if there wa no public shame associated with it,1
how do you feel about urination defecation flatulence fetish,0
have been feeling kind of depressed about all the bad news going on in the world what are some good thing that are happening that the news is nt covering,0
what your biggest pet peeve,0
for those that have gone from relationship to relationship without much time in between what are your thought on that,1
what is negative trait you currently have that you are working to overcome what step are you taking to overcome it,1
today is international woman day we ve got long way to go but in your lifetime what are the change you ve seen that have made life better for woman,1
what the best opera music can listen to while m home in my bathrobe so can strut around like m villain in movie,0
how do you feel about the concept of friendzone,0
what is your biggest insecurity,0
what is your opinion regarding instagram,0
would you spend year in north korea for dollar number number why or why not,1
what make you man,0
woman who have given their number to stranger they found attractive how did you do it and how did it pan out,1
ha partner of yours ever tried to make you break up with them instead of doing it themselves what were the sign,1
have you ever had diarrhea so violent that you had to check your ball after to make sure they re clean and of so what wa the result,0
should become celibate,0
have you ever turned down romantic relationship with friend you had feeling for if so what wa your reason,1
how much doe the mere glimpse of woman ankle or unkempt lock incite you into sexual frenzy,1
how long is long enough to wait before letting out fart while with so,1
