Questions	Male
Have you ever caught someone trying to take a creepshot picture of you? How did you handle it?	0
"Without explaining the context, what are you and your SO's inside jokes?"	0
"(Trigger Warning, SH) Ladies of Reddit, to counter the ridiculous ""Nice Guy"" (TM) claim that, ""It's only harassment if he's ugly but flirting if he's hot"", what are some incidents where you've been creeped out or harassed by a guy you considered very physically attractive?"	0
"Women who found love later in life, how did it happen?"	0
"It seems like women are shamed for wanting children or not wanting children, by both men and women. Why can't we just be ok with other people's life choices?"	0
"English teachers of Reddit, what was that one paper written by a student that really made you question their state of mind?"	0
"I just realized Doug's neighbors on the show ""Doug"" were a childless or childfree couple called Mr and Mrs Dink (double income no kids)? What realizations have you had about your favorite childhood shows?"	0
What has an ex ruined for you?	0
Have you ever wanted to take a break from life? Like take a break from it all and do nothing? Like go live with a friend that no one knows about and just be a bum for a year or 2?	0
"Mamas of Ask Women, what do you wish you'd discussed with your spouse/co-parent/babydaddy before making a baby together?"	0
When did you suspect your SO was cheating on you and how did you deal with it?	0
Do women actually like cum?	0
"If a guy wants to be your lover, does he got to get with your friends? And why?"	0
What do you feel about wearing girdles/body shapers?	0
What happened in an interview that raised serious concerns for you and made you turn down a job you initially really wanted?	0
"Ladies....does ""manspreading"" really bother yall that much or is just a vocal minority making it a big deal?"	0
Women who pee on the seat of a toilet and leave it there.... why do you do that?	0
What are some harmful things that movies are trying to normalize?	0
Is anyone else really sick of the blatant sexism going on around here?	0
People who have been very poor: what is something you've done to get by that impressed even you as a new ''low''?	0
Whats the sign of a bad roommate?	0
What’s your cat’s name?	0
"How do you feel about men who preface statements on non-gendered things with ""as a guy""?"	0
"A lot of people are really insecure about their bodies, hair, face, etc. But what is the best thing you have ever heard that’s made you feel really good about yourself?"	0
Those who 'do it all' (ie have excellent time management and are able to effectively lead busy lives) - how do you do it? what are the logistics and how do you keep from getting anxiety?	0
"What was your strategy for leaving an unsafe relationship? Packing, moving out, etc."	0
"Women over 65 - if you’re still working or newly employed, what is your job?"	0
What do you think of reddit's obsession with women?	0
"Ladies who are in a serious relationship, do you ever feel that you love your partner more than they love you? Have you ever brought this up with them?"	0
"Women of Reddit, what is your favourite tank or armoured fighting vehicle?"	0
What career did you want to have when you were younger? Did you achieve this?	0
What do you do to make yourself feel beautiful?	0
What is the most attractive thing that makes you like about a person?	0
What were some obvious (in hindsight) red flags that your SO didn’t love you anymore?	0
"Question for women - Can you describe an instance where the word ""creepy"" was applied to a guy in a manner that you felt to be unfair?"	0
Whats something controversial in the western culture but is completely normal in yours?	0
"Women who used to be afraid of online dating, how did you overcome your fears?"	0
Ladies of reddit: how much do you weigh?	0
What is your favorite picture of your pet(s)?	0
Women of reddit who stopped shaving - how long did it take you to get accustomed to it? Did you get any negative reactions?	0
What are some 'girl rules' that are unsaid but followed?	0
What is the sexiest piece of clothing that you own?	0
Are you Team White/Gold or Team Blue/Black?	0
"In your experience, what does ""kink friendly"" mean in a man's online dating profile?"	0
People who were seen as average or unattractive in high school. What was your experience like and what’s it like now?	0
"Women who have dated men that turned out to be misogynists, what were some of the red flags?"	0
I'm a trans woman who spent the first 21 years of my life trying to overmasculinize myself to compensate for my insecurities. What staples of a girls childhood/puberty/and high school years did I miss?	0
Would you date a guy that's a vegetarian?	0
What is you opinion about pickup/seduction?	0
Ladies of reddit! What is the first thing you do after a (long) work day?	0
What would you do if your friend offered you money in exchange for sex?	0
"Women with low self esteem, anxiety, or trust issues: How did you finally accept that your SO wasn’t out to ‘play ‘ you, and you allowed yourself to accept their love?"	0
How do you girls feel when a guy has butt hair?	0
Do you think that subs depicting cartoon child abuse should be banned?	0
"Okay, ladies. Let’s be honest. How many of us have had a crush on a video game character? If so, who and why?"	0
How do you create boundaries so others don't treat you like a human sponge for their emotions?	0
"When you're pooping on your period, how do you wipe in such a way that the tampon string doesn't get swiped back and get all poopy?"	0
"How did you overcome purity culture, especially in the way you dress?"	0
It's nighttime and I'm a male walking down a dark street. How should I behave so that you don't feel threatened?	0
How do you avoid feeling lonely as a single adult? When you do feel lonely how do you get over it?	0
Have you ever discovered that your were the toxic one a romantic relationship? How did you realize it?	0
The other B-word: The Ban Bossy Campaign. I think it's a great idea for encouraging girls to be leaders in our society. What do you think?	0
Which fashion trend do you most regret being part of?	0
What Female tropes in movies and TV is really bothering you these days?	0
What is something that women do in movies that if done in real life would have a totally different outcome?	0
You and the last person you had sex with have now swapped bodies. How’s that working out for ya?	0
What Double Standards Have You Experienced As A Woman? 🤷	0
"Do you know anyone who said, ""If Bush/Obama/Trump wins the election I'm leaving the US!"" and then actually did? If so where did they move to and did they stay?"	0
Why do AW threads that get downvoted tremendously also get MANY comments?	0
Would you date a man/woman without a pulse?	0
What are things guys wear or do that doesn't match their age? Example a 22 year old skateboarding looks wrong to me.	0
What’s a common misconception about sexual assault that really needs to be cleared up?	0
Hello Ladies. Why are your dildo's so big?	0
"Women who work in the fashion industry, what are your experiences? How does it compare to popular film depictions of women in fashion (Devil Wears Prada, etc)?"	0
"Women of reddit, do you enjoy FPS games? If so, which one, why, and platform."	0
What’s your dogs name?	0
What's something that you think is blatantly sexist but men disregard you when you tell them about it?	0
Why do period poos smell worse than regular poos? ...... asking for a friend 🤪	0
"Women of reddit, what do you think of the Bible?"	0
Where do you get your hijabs from?	0
What's your favorite book that you've read or listened to so far this year?	0
What is your favorite brands and flavors of sparkling water?	0
How do you act around someone in the office you have a crush on? Do you ever try to hide it?	0
"How do you handle living with chronic feelings of urgency and anxiety, aka ""Hurry sickness""?"	0
How do you deal with your insecurities?	0
"Ladies, my husband just fell asleep while going down on me. Tell me I'm not alone."	0
"Ladies, Could you fall in love with a man who was born a woman?"	0
What do girls get out of watching guys play video games?	0
"If your SO is cheating on you and someone knew, what would you want them to do?"	0
How do you treat yourself nicely while you’re on your period?	0
With which Taylor Swift song do you most strongly identify?	0
How do you stop being everyone’s “hype woman” when no one is yours?	0
What's your best duckface?	0
How do you get over someone you’re madly in love with?	0
Women with male roommates; how do you find them?	0
How do you sleep while on your period?	0
How do you get the confidence to travel on your own if your friends can't join you and you don't have an SO?	0
Do you find guys with glasses or without more attractive in general? Why?	0
"How do you deal with it when you need romantic cuddle time/physical affection but can't get it for whatever reason (your SO is elsewhere for example, or you don't have one)?"	0
"If abortion became illegal, and you wanted to terminate your pregnancy, what would you do?"	0
For the Ladies - What do you feel about your SO's penis during sex?	0
I just got catcalled on my way home from a feminist rally where one of the main topics was street harassment. What irony have you experienced lately that REALLY got under your skin?	0
What’s you least favorite household chore?	0
How do we feel about the new Ghostbusters?	0
How does working out effect the size and shape of your breasts?	0
"Attractive women with ugly friends, how does your ugly friend get treated different?"	0
Women who dated/slept with losers. Why?	0
"If 007 were a woman, what would be the name(s) of the ""Bond boy""?"	0
Is a guy being tall an automatic turn on for you?	0
"Strippers of Reddit, what is something you wish your customers knew?"	0
What common criticisms of women or femininity make you cringe?	0
Women who ended long-term relationships with generally supportive partners who are not abusive: what ultimately convinced you to end the relationship? Was it the right decision?	0
How do you prevent yourself from becoming clingy when dating someone you like a lot?	0
"How would you feel being asked at the end of a date, ""Can I kiss you?"""	0
"Does anyone remember those sweet virtual ""paper doll"" dress up websites back in the early 2000s?"	0
"Is “You wear too much makeup, you would look better without it” a compliment? What’s your opinion?"	0
Fox news mentioned a study that all men combat teams do better than integrated ones. What's your thoughts on this.	0
"Ladies, how did your life change when you meet the right person after having awful luck with dating?"	0
What transitions or changes did you least expect after childbirth?	0
"Ladies, how do you deal with hair loss?"	0
What female character tropes/cliches irritate you the most?	0
“Street smart” women- what are your tips to keep yourself safe?	0
"Girls suffering with depression, how is ur date life like?"	0
"People whose S/Os are considered very attractive, what are your best stories of them getting hit on around you?"	0
What do you think about the unshaven armpits trend?	0
What’s the most fulfilling thing in your life?	0
How satisfied are you with the current way society is socializing young teenagers to approach the topic of sex & what changes should there be?	0
"You eat small shelled candy (Nerds, M&Ms etc) in the late afternoon. That night you remove your bra and there's a candy stuck to your boob. DO YOU EAT IT?!"	0
What do you like about being in a relationship?	0
How do you guys feel about the maleism movement	0
"Women who have long photo shoots for Instagram for fun, what's the appeal?"	0
What do you like to talk about with strangers?	0
What is the most annoying thing an SO can do?	0
"Ladies, what's the hottest encounter you've ever had with a stranger?"	0
"How do you define ""genderqueer""?."	0
What complaint about women are you absolutely sick of hearing?	0
"If confidence is such a big deal, why do men insult us?"	0
Women who work multiple jobs: when do you find the time to work out and what is your go to workout?	0
How many times a day do you think you look at yourself ? Including photos. Ever done a count? Anyone ever “quit” looking at yourself?	0
"If a random man had to spend the next year of his life as a woman, what do you think would be the most surprising thing to him?"	0
What is the most unusual kink that someone you dated revealed to you?	0
"If you've ever had a creepy or unexplainable thing happen to you, what was it?"	0
"What can we, as a hackerspace, do against sexism?"	0
Women who have given up on love - How do you feel?	0
Slut Shamming - Can you ever be ashamed of doing something you think it fine to do?	0
"Guy here. Apparently I'm hot now, and the attention is making me oddly nervous. Any advice from girls (or other guys) who have gone through this?"	0
How do you prefer a guy to initiate sex?	0
Why do you think some people are so against Socialism when it would help so many people and may actually make people happier?	0
How do you maximise your time in the evening after being at work?	0
"What do you guys think about ""pussy pass""? Do you believe it is an actually recurring phenomena?"	0
Do girls usually wait for guy to start the conversations all the time?	0
What fictional couple were actually horrible together even though they were written to be happy together? Why?	0
"To what point could a fellow female be dressed so inappropriately, that it would unsettle you?"	0
What are some things that happen while giving birth no one talks about? Nervous here!	0
What is a self taught skill you became good at and how easy or difficult was it to stick it out through the learning process?	0
Other than love sex & money what do you need most from your other half?	0
"Girls, what would you do if a guy was using a spongebob squarepants underwear in your first time with him?"	0
Is there a smell that brings up an old memory for you?	0
What kinds of situations do you categorize in “That’s hypocritical” “Not my business” and “I should say something” in your friends circle?	0
"If autocunnilingus were possible, would you do it?"	0
What's the worst/most awkward way someone has tried to seduce you?	0
"Rich, single women of Reddit, how do you avoid gold-diggers when dating?"	0
What songs do you listen to to cheer yourself up?	0
What is so good with your SO's face and what you love to do her/his face?	0
How do your stop thinking about your ex who dumped you because they like someone else?	0
What was a tiny lifestyle change that enormously affected the quality of your life?	0
YO IM SICK OF DATING QUESTIONS CAN WE JUST TALK ABOUT TEA FOR A MINUTE?	0
Is chivalry dead?	0
"I am a young woman who just discovered that I LOVE cheese after avoiding it my whole life, what kinds of cheese would you recommend I try next? (urgent)"	0
Have you ever encountered someone and felt a chilling dread as if they were evil? What was the encounter like and did your instincts turn out to be true?	0
What is something small/random you’d like to accomplish/experience before you die?	0
"Hey ladies, when's the last time you laughed by yourself while eating a salad?"	0
When did you realize that you or your SO were the clingy one in a relationship?	0
"AskWomen, what is the rapiest thing you've seen happen at a frat/sorority party?"	0
What’s your feel-good tv show?	0
How do you stop taking things so seriously?	0
"What does the ""female gaze"" look like?"	0
Older women of Reddit: what kind of things have you noticed happening with your body/mind/spirit as you've aged that no one told you about when you were younger?	0
What makes your legs shiny?	0
"Women in relationships with other women or trans men, how does sex work?"	0
"Guy here, what do women think of men with PPP?"	0
"Me (m) and woman alone at bus stop at night, any way I can indicate interest in her without giving off rapey/creepy vibes?"	0
"Women that are working, college students: what are your secrets to success?"	0
"In your opinion, what romantic movie stands out for handling the issue of a man pursuing a woman in a consensual, non-misogynistic way?"	0
What's the most ridiculous thing you've been dress coded for?	0
Would you be okay with your SO hanging out with a cam girl?	0
"Ladies, do you think little boys are ""cuter"" than little girls?"	0
How many of you ladies identify as feminist?	0
"Women who used to be anti-feminist/not-pro-woman, what changed your point of view?"	0
Casual Convo Fridays.	0
"Those who have had an encounter with the paranromal, what was it like?"	0
"Women over 30, what pop cultural thing do you still follow despite becoming older?"	0
Daughters who don’t have close relationships with your mothers: how do you cope?	0
"What makes you unapologetically, utterly, truly happy every single time without fail?"	0
How often do you cry? Do you consider yourself to be empathetic or sensitive? Do those mean the same thing?	0
"What's something about your body or appearance that society/marketing says should bother you, but you honestly couldn't care less about?"	0
What's one aspect of being adult you found weird/never anticipated?	0
How did your relationship changed you in meaningful ways that you are thankful for?	0
"What is something that always helps you on sad days, particularly when you are feeling so down you can't bother to eat, shower, workout, etc?"	0
"As a man, how can I respectfully deal with ""feminist"" types in my academic environment?"	0
"Women of Reddit: I have always wondered, do you ever watch porn?"	0
"Married ladies of reddit, what’s the difference in how men treat you vs before you were married?"	0
What qualities do women look for in a man that men may not be aware of?	0
Any stories of having a best friend who later turned into your significant other?	0
"Moms, what is the hardest part of raising a teenage daughter?"	0
What is your #WhyIDidntReport story?	0
How has your opinion of your mother changed as you've gotten older?	0
When was a moment when you felt genuinely proud of yourself?	0
How did you personally glo up before the term existed?	0
[NSFW] Is a man coming during sex important?	0
What moment made you realize you had more-than-friend feelings for a friend?	0
"When performing oral sex on a male, do you spit or swallow?"	0
"Why do you girls make guys ""wait"" for sex?"	0
"[nsfw] Porn models of Reddit, how has being a porn model (or putting up nude pictures online) affected your life?"	0
Today is my 22nd birthday. How do I embrace it and not fall victim to the quarter-life crisis?	0
How would you women on here define a 'fuckboy'?	0
One Million Subs	0
Do you shower with a tampon in? Why or why not?	0
What was the worst bacteria/infection/flu you ever had?	0
"How awesome is it when your girlfriend/wife kisses you and tells you she loves you, and why?"	0
"Very tall women (6'+), is your life very hard? Are you single and can't find love because of your height? Are you single? If so, why?"	0
"Women who've lived under and escaped dictatorships, what are some habits you acquired during that period that have stuck with you?"	0
What's a cool fact that can brighten everyone's day?	0
What is the self-deprecating inside joke that only you and a select few can make?	0
"What do you think of Emma Sulkowitz(""Mattress girl?"") [SUPER SUPER SERIOUS]"	0
What was the best trip you ever took with a SO?	0
What is a personal and intrusive question that you get asked (that you suspect men don't)?	0
"Transwomen and those who may not fit in the gender binary, how do you feel someone should go about asking what pronouns to use?"	0
What do you all think of sexism against men?If you think it does not exist please explain why?	0
How would one non-violently put a woman in her place who's hit a man?	0
What's the easiest way you've found to get your daily fruits in?	0
What's your favorite song from the 2000s?	0
"Why do so many women think it's acceptable to rudely reject men who approach you in a social situation such as a bar, lounge, party?"	0
"As compared to men, do you think it's easier, harder, or about the same difficulty for women to find casual sex partners? [xpost]"	0
What tastes so good you can’t believe it’s healthy?	0
Do you ever buy clothes because you'd really like to be the kind of person who wears them but then feel weird about it and never actually wear it?	0
Why are most of the questions here about what we think of men?	0
What do you think of Iceland as a place to visit?	0
"Women aged 40 and/or above, what words of wisdom can you give women in their 20s?"	0
"Bi/pan women of AW, do you feel as if you're letting down other gender/sexual minority women when you're involved with a man? If so, how do you process those feelings?"	0
Would you have a relationship with a bisexual man?	0
What is Sex on LSD like for women?	0
"Women who had an awesome ex, why was he awesome and why is he your ex?"	0
Have you ever masturbated in a place other than your house?	0
How often do you listen to polka music?	0
"What's your ""ask your husband's permission"" story?"	0
What do you think about herbivore men?	0
What is your spirit animal(s)? Why?	0
What's the most obnoxious attention seeking behavior you've witnessed?	0
What's something other than rolled up sleeves that makes a man's outfit attractive?	0
"Ladies, what type of sexting do you actually appreciate?"	0
"Ladies making over $100k per year, what do you do?"	0
Do you think Taylor Swift is attractive?	0
What are your thoughts on marriage?	0
How do you get when you go too long without masturbating?	0
What is something that you didn't learn about the opposite sex until living with them?	0
What are some acts of kindness you do around the holidays?	0
For those that have gone from relationship to relationship without much time in between what are your thoughts on that?	0
What was your experience like visiting England?	0
How do you deal with a colleague that’s always trying to one up you?	0
Ladies who have mastered the art of self-discipline...how did you get there?	0
"Bisexual women, what's your experience with biphobia from the lesbian community?"	0
Question for women with big boobs that wear low-cut shirts	0
"What's your ""when you look at someone through rose-colored glasses, all the red flags just look like flags"" story?"	0
How do you feel about receiving something like a postcard in the mail from a friend or someone you like?	0
"A friend's kid genuinely thought adults grew tattoos based on their personality. If this were true, what would yours be?"	0
What do you think about much older men trying to date much younger women?	0
Why isn't WGTOW as popular as MGTOW?	0
How many times have you had to take Plan B in your life & did it work for you?	0
How do you cope when a friend copies your look?	0
"If you've went on a few dates with someone, how would you feel if he/she tried to hold your hand before kissing?"	0
"To women who don't want to have sex before marriage, how do you manage modern relationships?"	0
"What shoes do you like to wear most - flats, heels, boots or..? Why?"	0
In what ways have you seen your mother and/or grandmother experience and be affected by sexism?	0
In what ways have you surprised yourself?	0
"Women, why so many of your Instagram photos are your selfies?"	0
"Women of Reddit, what is something a person has done on the first date that made you want a second date?"	0
Do you have a story of finding out about your partner as LGBTQ+?	0
What do you do for fun?	0
ASKWOMEN HOW HAVE YOU BEEN PERSONALLY VICTIMIZED BY REGINA GEORGE?	0
"Women of Reddit, who have had a crush on another person while in a serious relationship, how did your feelings for your partner change?"	0
Let's say a close male friend wanted to ask you out. How would he do that without torpedoing the friendship?	0
What's the quickest and easiest method of shaving your legs?	0
How did you get out of a rough patch with your SO?	0
"Ladies who are in long term relations (3, 5, 10 or more years), do you still get romantic surprises, do you still have passionate kisses and sweet cuddles? How did you manage to keep it this way?"	0
What was the most uncomfortable thing you’ve had to do for your SO out of politeness?	0
"Glasses wearing ladies, aren't Christmas lights viewed without your glasses one of the prettiest things ever?"	0
Do women like a guy with a big butt?	0
"If a male friend was to admit stronger feelings and ask you out, what would be the way you'd prefer him to go about it?"	0
Do you expect a man to prioritize your orgasm?	0
"Where do you want to be in 1 year, 5 years, 10 years from now?"	0
"Mothers of boys, what are some of the most surprising things you have discovered while raising them?"	0
Why do woman feel obligated to chastise those who dress scantily-clad?	0
"Mothers of Reddit, what is one time your mothers intuition saved your child's life? What is the story?"	0
What was it like the first time someone confessed their love for you?	0
"Ladies who have faced emotional/mental abuse in the past and overcame it, what would you recommend to someone who needs to cope with it?"	0
How can the obesity epidemic be stopped?	0
Would you rather your husband/boyfriend watch gay porn or straight porn?	0
*UPDATE* Should I tell a girl I know that there are naked pictures of her on the internet? *positive they are her*	0
"If  we lived in a world where rape was not against the law, do you think that men would be just raping women all over the place? "	0
What's you favorite part of being an Aunt?	0
How do you cope with loneliness and the desire to be held when alone when tired and trying to sleep?	0
