Questions	Male
Men of AskWomen: What brings you here?	0
"Women of Reddit, do rockstars REALLY get the girls, or is that a myth? What’s your back stage story?"	0
What’s a self care thing you do that you swear by?	0
How do you feel about taking separate vacations from your SO? What if time and resources limit the opportunities for vacations?	0
How do you deal with your FUPA? Any clothes that can disguise it?	0
"If you have an air purifier in your home, what differences have you noticed in health & has it been worth it?"	0
"If your username were a fictional character, what would their story be?"	0
What phone are you currently using? What case does it have on it?	0
How do you feel about your boyfriend giving you a rose?	0
"Yesterdays biracial thread scared me a bit as a white guy who will probably marry an Asian woman, were there any positives to growing up biracial?"	0
"Where do you get ""ethical"" porn?"	0
Who will you vote for in the 2016 election?	0
Women who were mean girls as teenagers: what things could your parents have done to prevent you from becoming a mean girl?	0
Fellow Women: What is your holy grail product or service that you're surprised more people don't use?	0
Which accent is the sexiest?	0
"In a relationship, besides jealously, what instantly screams ""insecurity"" to you?"	0
What are the blatant sexist/misogynistic issues that women face on a daily/regular basis?	0
Women who eventually want to get married... after how long does your partner avoiding the topic become a huge red flag?	0
What’s your “never again” story?	0
"What is a stereotypical ""girlfriend"" thing you never thought you'd do, but now you can't help it."	0
"Ladies, why are you so beautiful?"	0
"Does anyone else notice they ""go number 2"" a lot, or more often, when they're on their periods?"	0
"Extroverted womans who married a introverted mens, does it work? What's your story?"	0
"Do you struggle with befriending other females? If not, how do you do it?"	0
What perfectly normal thing annoys you?	0
How worried are you that a more conservative court will overturn aspects of Roe v Wade	0
How do you deal with difficult coworkers?	0
What are your feelings on dating someone with depression?	0
"Hypothetically, if a guy were to annex a small bit of another country, and a lot of people were mad, would this make him undatable?"	0
What has been the most romantic frugal date you have been on?	0
What's the creepiest thing that happened to you INVOLVING a guy	0
"Women who ""started"" life at a later age how did it turn out? Do you have regrets?"	0
"Ladies who have a friend with benefits, what sort of boundaries do you set?"	0
What is the most insulting assumption a sex partner has made about you?	0
"If pregnancy is so painful, why do some women like being pregnant?"	0
How many chickens would it take to kill an elephant? What would their strategy be?	0
What is the most sheltered thing you heard from someone?	0
What is something about women you feel a lot of men think is true but isn’t?	0
[Update - I had the interview] A potential employer made a sexual joke during our e-mailing back and forth. Bad sign?	0
What's in your bucket list?	0
What is a trait your ex had that is now a deal-breaker for future partners? And why?	0
Don't you just wish Newt Gingrich and other old white haired Republican men would just crawl under a rock and die?	0
"What are some things that are amazing when they're good, but awful when they're bad?"	0
[Trigger Warning] What do you make of Chrissie Hynde's latest remarks in the news?	0
"Ladies, do you feel that men sometimes don't take us seriously about what we go through with creepy guys?"	0
"What screams out ""fuckboy""?"	0
Have you ever dated a bisexual guy? What was that like?	0
What are some tips for kissing?	0
How do you deal with a UTI?	0
Ladies what has been the longest amount of time you had gone without sex?	0
"Would you consider this cheating, or is my girlfriend overreacting?"	0
What's your favorite form of physical affection?	0
why don't women ask out guys more?	0
Would you date a man with a small deck?	0
"Ladies who have worn white to someone else’s wedding, what were you thinking?"	0
What LPT (life pro tip) actually blew your mind and solved a real problem?	0
Is anyone else being judged for their decision to not have children and how do you deal with it?	0
How would you describe the perfect outfit to wear with intent of getting something for free?	0
"Have any of you ladies had success keeping a healthy relationship while feeling as if he or she is not ""the one?"""	0
How do you deal with guys mistaking your friendliness for flirting/interest?	0
Update - Passing a girl on the way to work	0
"Women of reddit who don't comment on posts, why don't you?"	0
Has anyone ever stuck it out with someone who wasn’t ready for a relationship? Why or why not?	0
"What are your trademark signs of being stressed out, even if you’re not totally conscious that you are stressed?"	0
Does anyone else disagree with the current work/life balance that exists in society? (9-5 5 days a week)	0
What are some ways MEN are treated in society that apall you?	0
"Ladies with a very well-endowed SO, how did you learn to stretch and handle his penis without pain?"	0
How do you know if you love someone or if it’s just lust or the fear of being lonely?	0
"anyone else the ""ugly friend""? If so, how do you deal with it?"	0
"How scared are you that the current hate towards women (incels, mgtow, etc) will become violent and affect you, personally?"	0
What post or response stuck with you in AskWomen? [NSFW]	0
I am tired of these stupid theoretical questions on this sub.  How are you doing today?	0
"Women of Reddit, have you ever cut your hair during a time of distress? What happened?"	0
What’s something a guy can say to you that will always make your day/never get old?	0
How do you deal with male coworkers treating you like you’re their de facto assistant?	0
"What are some spectacular female-directed films that have missed out on being nominated for awards over the years, thanks to the misogyny of the film industry?!"	0
"Ladies who digs tattoos, what's are some popular style you think looks good on men?"	0
How do you prevent any shaving bumps when shaving your bikini line?	0
Which aspects of dating culture do you think needs to permanently retire and why?	0
What female AND male body size do you find most aesthetically ideal? (X-post /r/AskMen)	0
Houseplant obsessed people: What are your hacks? Was it easier to learn about plants online or from a book? How did you learn to not kill plants? etc?	0
Wearing heels to special events - is it plus or must? Why?	0
"Ladies who have had a son, has having a son changed the way you view males? If so, in what ways?"	0
Who are the lovers who haunt you and why do they haunt you?	0
What is an issue/issues that you believe deserve to be talked about more?	0
"I've heard of guys ""thinking with their dick"". What's your story of ""thinking with your pussy""?"	0
Why do you love make-up?	0
Any tips for a (first) gynecologist appointment to go well?	0
What are your core values?	0
What have your experiences been with antidepressants and other depression treatments?	0
Women with no male friends... how are you doing?	0
What are/were the Best & Worst cities for dating?	0
What was the greatest moment of woman's intuition you have ever experienced?	0
"Do you approve of calling an another woman “Bro” or “Dude,” why or why not?"	0
Why do older women cut their hair shorter?	0
"Ladies, What qualities/skills/habits a 20 year old should gain that will make him a better boyfriend/husband/father in future?"	0
"What's your best ""Don't let crazy stick his dick in you"" story?"	0
What are some stupid things your SO does that you find funny?	0
How to fix an asymmetrical face?	0
"Women who got pregnant from one-night stands or casual partners and kept the baby, what was your experience?"	0
Have you ever slept with your SO's friend? How did that turn out? (x-post from AskTrollX)	0
"I've been invited to a ""Dress to Kill"" party in August. This can be anything from an assassin to a giant bacteria. Has anyone got any ideas of a good female character to dress as?"	0
How did you choose your major?	0
"Women with children, how strongly would you promote gender roles when raising your sons/daughters?"	0
"When scientists study the differences between men and women, are they studying gender or sex? How often do they fail to even make that distinction?"	0
What is the best/funniest compliment you received from a guy?	0
"Those of your who live with your SO, what is your evening routine like?"	0
Do you have a lot of friends that you trust? Or just a few? Are they mostly women or men? And how do you decide to trust them with your friendship? Or do you keep them at arms length?	0
"Women who switched from male-dominated industries to more gender-balanced industries, what were some things you noticed?"	0
How to get over fear of driving?	0
What item of clothing should be eliminated from all men’s wardrobes?	0
"People with stupid names, how's life been treating you?"	0
"Women who wasted a lot of time in bad relationships, how did you eventually come out of the cycle and find the right one?"	0
What's the dumbest thing you've done in the name of beauty?	0
"Does anyone have any experience with being in a Sugar Baby/Sugar Daddy relationship? If so, do you have any advice or insight?"	0
"Women, what do you think of men of age 30+ who haven't been in a relationship?"	0
What assumptions/stereotypes you have encountered in your life that you absolutely hated?	0
"AskWomen, can you sense bitterness in a man?"	0
How do you prepare for an upcoming trip/vacation?	0
What's the strangest thing you've ever seen someone cry about?	0
"HEY, HEY, HEY... HEY LADIES!!!!! WHO WANTS TO TALK ELECTION NIGHT POLITICS AND THE IMPACT IT WILL HAVE IN THE NEXT SEVERAL YEARS? AWWW YEAAAAAHHHH!"	0
What is your abortion story?	0
What is that one childhood memory you look back on and cringe?	0
What are some ways you can be intimate with your partner without resorting to sex?	0
"How would you feel if you were pregnant, and you wanted your SO to go get frozen yogurt, only for them to return with yogurt with a picture of Elsa on it ?"	0
Does anyone here drink Matcha Green tea? And if so what brand do you recommend?	0
What’s something that will always make you feel good?	0
"Is anyone else tired of the constant ""not all men are like that,"" comments on every single discussion in this sub?"	0
Why do so many women love stories such as Twilight and 50 shades of grey knowing that the relationship is abusive towards the woman?	0
To swallow or not to swallow? Ladies...this is the question...	0
"What's your go-to ""comfort food"" tv show?"	0
"Women who befriend mostly men, how has it changed your perception and relationships to other women?"	0
How have guys reacted when you didn't cooperate with their chivalry?	0
What's something harmless you take really personally when you probably shouldn't?	0
What genuinely turns you on every time?	0
"What movie/television series do you wish you had never seen, just so you could experience it for the first time all over again?"	0
What are some things that you are trying to improve about yourself right now?	0
"Bi/Lesbian Women have you ever developed feelings for your female best friend? If so what did you do? Straight Women, how would you react if your Bi/Lesbian best friend told you about their feelings for you?"	0
How were you diagnosed with ADD/ADHD as an adult?	0
"Women, how many cats until ""you"" are officially a crazy cat lady?"	0
"Assuming you are single, if a guy approaches you to ask you out, what things in his behaviour and what he says would make you more likely to say yes?"	0
"Womens of Reddit with unexpected pregnancies, how was your partner's reaction when you told t you were going to have a baby?"	0
What is the pettiest thing you have done after a breakup?	0
What bad qualities do you wish people would stop glorifying or rationalizing?	0
What does being a good wife mean to you?	0
Giving birth: what you wished they told you about it	0
How do you cope with being single when you don’t want to be?	0
Have you ever received a death threat or rape threat? What happened?	0
What are some things to be aware of before moving out of your family house on your own/with a roommate?	0
What was the most spiteful act you committed?	0
How do you feel about the use of the n-word in Tarantino films?	0
When have you experienced mansplaining?	0
What are the NSFW subreddits that are really worthy (not based on sexual excitation but for body positivity)?	0
How your self-image has been changing over the years?	0
"As a man, how should just react to a woman breastfeeding?"	0
What to do when your relationship becomes dull?	0
"For suit-shopping/work clothes, men have Men's Wearhouse. How hard is it for women to find fitting, matching suits?"	0
Have you dated both ugly men and sexy men?Have you noticed any significant difference between dating ugly and dating sexy?	0
"What are your opinions on your SO having a foot fetish (toe sucking, footjob etc.)"	0
So I'm like 90% sure Regal Movie Cinema is blatantly sexist towards men when it comes to searching bags- I wanted to know have any of you women ever gotten your bags/purses checked?	0
"It's official, a woman is now a major party presidential nominee for the first time in American history. How do you feel?"	0
"What's a situation you could never imagined yourself being in, until you were?"	0
"What has been your experience with ""right person, wrong time"" relationships?"	0
Who or what can make you laugh?	0
Women do you have any transgender friends and relatives and how is there life and dating life???	0
How do you feel about your partner's bed head?	0
"My hands smell like bacon jerky, is this attractive?"	0
"To those with Premenstrual Dysphoric Disorder (PMDD), how can your partner best support you?"	0
What made you lose your self love or self esteem in your romantic relationship? Was it your partners behavior? Your own struggle with depression/anxiety? Environmental factors like family or living situation? How did you get it back?	0
"Ladies of Reddit, does the way men objectify and judge Women so openly bother you?"	0
"Short women, where do you buy your pants?"	0
"The top question on AskMen with over 3000 upvotes is ""You ever pooped so hard it gave you a boner?"" AskWomen, when was the last time Reddit made you question how heterosexual attraction is even possible?"	0
What are your thoughts on having a partner that can't cook?	0
"What have you gotten ,or gotten away with because of ""Pretty privilege""?"	0
What hobby/solo activity do you recommend to a young 20 something trying to “discover themselves”?	0
"Do you ever wonder about female stereotypes of bygone eras? For example, what was the 1860s equivalent of a woman who wears Uggs and loves Starbucks? Or maybe there is no similar stereotype. What other ""types"" of women may have existed in the past, but don't today?"	0
"Ladies, have you ever used your own vaginal fluid as a perfume?"	0
I'd rather be single than date overweight women.	0
"Working and active women of reddit, what do you usually have for breakfast?"	0
What's you're latest recurring dream about and do you look up the definition of these dreams?	0
"Lots of celebrities getting fired for sexual allegations yet our president still holds office, thoughts?"	0
What does a Post-Patriarchal world look like to you? How does it make you feel when you envision it?	0
What do your breakdowns really look like?	0
"What song do you want to play when Maury Povich looks at you and says, ""You are NOT the father""?"	0
When was the last time you laughed so hard that you cried?	0
Anyone else extremely uncomfortable how so many people are acting because they can't harass fat people on reddit anymore?	0
"Do you believe social media has normalized dramatic changes being done to yourself, such as a nose job or body changes? If so, has it affected you in any way?"	0
"Those who relate to the fig tree scene in the bell jar, how hasn’t life turned out for you and do you still constantly wonder what if?"	0
Do you personally ever find short men (5'7 or shorter) sexually attractive?	0
"Controversial: Ladies, have you ever fantasised about a cousin?"	0
"Imagune you were at an interview and everyone else there was from Harvard, Yale, Stanford etc. How would you feel?"	0
"Introverted gals, what connects with / attracts you in a man's online dating profile?"	0
"Women whose partners travel for work: how often do they travel, and how do you avoid worrying about something happening to them while they're away?"	0
Women who have shared bathrooms with trans women: what was like? Did it feel awkward?	0
Any of you ladies facing a quarter-life crisis? How do you handle it?	0
What have you learned from your past friendships?	0
What's your favorite way your boyfriend initiates sex?	0
"Lesbian couples who have children, how did you decide who's carrying the baby?"	0
how did you know you were a lesbian?	0
What’s a hard truth you wish more people knew?	0
"Black Women, do you get much backlash when you date white guys?"	0
"My dog died today. Ladies of Reddit, how do you grieve the loss of a pet?"	0
Women scientists of Reddit - what are you researching/ working on at the moment?	0
Women that were friends with their SO before getting together: What did your friendship look like? How did you make the transition?	0
What kind of magazines you girls like to read?	0
"Women who make over $150k/year, what do you do?"	0
"[Controversal] Women who get offended by other women breastfeeding (pictures, public, etc), why??"	0
What do you think Toxic Feminity is?	0
"when meeting a guy for the first time, what makes your douche radar go off?"	0
What sort of SO do you attract (from AskMen)?	0
"So, ladies, is a micro/very small penis honestly a deal-breaker?"	0
"Why does Reddit seem male-dominated, even though almost half of users are female?"	0
"What made you say ""never ever again?"""	0
"That friend of yours that’s always single, what do they need to hear to that they just won’t accept?"	0
"Women of Reddit, what can I do to advance women's rights if I couldn't go to any of the Women's Marches today?"	0
"What are some good safety practices--physical and/or sexual--for dating? If it came to sex, your place, their place, elsewhere?"	0
"Ladies, what have you learned from previous relationships and what kind of men/traits in men do you avoid?"	0
"If you could have gotten into the online streaming industry earlier in your life, what content would you have streamed?"	0
What was the most important lesson you’ve learned from a heartbreak?	0
"What's an example of a character (from movies or television) that's meant to be ""good"" but they really come off as evil more than anything?"	0
What kind of compliment would you like to receive more often?	0
What are some of the relationship troubles/doubts that are solvable but seem insurmountable in the moment?	0
"Ladies, what IS feminism?"	0
What's something you've said that you wish you could take back?	0
How sexy do you dress on an everyday basis?	0
What are your favourite educational YouTube channels?	0
Are spaces for women-only discriminatory against people who are trans or nonbinary?	0
What are your favorite picnic foods?	0
What do Caucasian women think when a Brown guys approaches them because he is interested in you?	0
In which subtle ways do you harmlessly manipulate your partner and what are you hoping to achieve with it?	0
What not so glamorized career path is actually a pretty good one?	0
What is you view/opinion on abortions?	0
What do you think about twerking?	0
What's the funniest joke a kid ever told you?	0
What are your thoughts when you see a woman in public without a bra on?	0
"Hopping off the back of another post, those who where ‘mean girls’ in school, what are things like now?"	0
What’s the best story you have of someone missing the moment to ask for your number/a date but redeemed themselves?	0
"Who is your daddy, and what does he do?"	0
"What was your worst ""nice guy"" experience like?"	0
My new girlfriend says my penis is too big to to comfortably have sex. Is there anything that women can do to prepare for a larger penis?	0
Was there ever time you deliberately dressed to cater to a/the male gaze? If so why and what happened?	0
"For those of you that have been blindsided by a breakup, what did you do to recover from it?"	0
What old TV show would you like turned into a movie?	0
Is anyone else infuriated by Reddit's reaction to the USA's Women's World Cup victory?	0
What are some things about office culture you wish you had known about before starting your job?	0
How Do I Make Girlfriends?	0
"What about your SO made you think ""wow, I'm so glad I left my ex"""	0
what do u guys think about Tinder?	0
What time do you usually eat dinner?	0
What makes you swipe left on Tinder?	0
I’m absolutely terrified of pregnancy and giving birth. What is it like? What makes it ‘worth it’?	0
What's a little thing that your woman does that sends you over the edge during sex?	0
How do you love yourself?	0
"If you could sleep with any character on Bobs Burgers, who would it be and why?"	0
Does anyone feel really pretty one day but absolutely ugly the next?	0
"Women who do not identify as feminists, will you share your worldview and/or thoughts on feminism?"	0
"Women who gave ""nice guys"" a chance how did it work out?"	0
We meet in class and go for spontaneous drinks afterward. We make it back to my place I take my shirt off and I'm wearing a weighted vest under. What goes through your mind?	0
"What was your ""well,this is who I chose to spend the rest of my life with"" moment?"	0
Would you date someone who identifies as an Egalitarian?	0
"Women who aren’t into casual sex, how do you navigate in the dating world which seems to involve lots of casual sex?"	0
"For those of you with experience on the matter, how have you dealt with a partner that's failed to fulfill your sexual needs?"	0
"If a man expects his girlfriend to spend more money than he does on taking care of herself, is it OK for him to expect her to share the other bills equally?"	0
"Ladies who left someone at the altar, what is your story ? And do you regret it today ?"	0
"Fellow women, how to stop feeling depressed about your appearance/comparing yourself to your friends?"	0
Have you ever become friends with your ex's new girlfriend?	0
What do women do if they get their period in public and can't get to a bathroom?	0
Are man boobs disgusting to women?	0
"Why do a lot of women get long nails, what makes them so appealing for you?"	0
"Ladies, what are your thoughts on jobs in the sex industry?"	0
Would you date someone with Down’s syndrome?	0
Do you feel that you get enough sleep? Why or why not?	0
I just watched Magic Mike and feel very inadequate. Is this how girls feel all the time about how women are portrayed in media?	0
Do you think that male attractiveness is different from female attractiveness? Seems like women often care more about other women's looks than mens.	0
What are some PROS of having sex with an overweight guy?	0
"UPDATE: Unmarried man[37] will be having his daughter[16] stay with him for a while. The catch is, we haven't seen each other since she was 5.  Bonding Ideas?"	0
Women who read - what motivates you to do so? & when do you read?	0
"Can you say ""Fuck God"" without feeling sacrilegious?"	0
Ladies who grew up without a dad: what is the most memorable moment youve had with your mom/guardian?	0
Dear ladies of reddit what are your thoughts on pegging? Are you willing to try it?	0
"Dear Women, have you ever been in a happy relationship but just felt that longing to be single? How did it come about for you?"	0
What are some beauty secrets your older females relatives swore by?	0
"What does, ""the future is female,"" mean to you?"	0
What do you sound like? (recordings preferably)	0
My sister dropped a pizza FACE DOWN on the ground. What petty shit will you NEVER FORGIVE someone in your life for?	0
"To piggyback off of the ""what's the rudest thing a guy has said to you?"" Post... What's the NICEST thing a guy has said to you?"	0
"Enough about sex, dating, and all the existential shit. Ladies, what's your favorite color(s) and why?"	0
Are you sick of hearing about trans issues in /r/askwomen?	0
How do you recognise that you are being taken for granted? How do you differentiate that from someone just hurting and hence being distant?	0
How did you cope with being at different stages in your life to your friends in your 20s?	0
What's a ridiculous rule your parents had when you were young?	0
How’d you end up with your dream job?	0
What's the main reason you ended a 5+ years relationship?	0
What drives women (sexually) crazy? [NSFW]	0
"Adult women of Reddit, how did you stop waking up exhausted? Put another way- how do you wake up energized and excited for the day ahead?"	0
What does your perfect engagement ring look like?	0
"What's your location (state, province, city) privilege? (Please include the location)"	0
Has anyone here been in an emotional affair and willing to share their story? How did you heal the relationship with your partner? How did you manage having strong feelings for someone other than your partner?	0
"Those with experience, how did you tell your family about your assault?"	0
What are some body types/imperfections you find attractive that isn't included in mainstream porn?	0
What is one childhood story/event your family always tells about you?	0
