Questions	Male
What mistakes did you make early on in your career? What would you tell someone first starting out?	0
What are your experiences in Men using you as a therapist?	0
"What kind of small, mundane magic are you capable of?"	0
"Married couples of AskWomen! What’s that moment which made you go “okay, I’m gonna marry her/him”?"	0
What is an actually good movie that too often gets dismissed as a “chick flick”?	0
"When something in your life feels off, but you can't put your finger on what it is, what do you do?"	0
Where would you place your pet(s) on the intellect spectrum?	0
Why do you think a friend of yours will be single forever?	0
How u doin ladies	0
I see posts of people surprising their SO with a Nerf fight or a blanket fort. What fun surprise would you love to come home to? (Originally posted to AskMen)	0
How do you feel when someone points out your privilege? Why do you have that emotional response?	0
What’s your tip for rebuilding intimacy in a relationship?	0
Women of reddit: what is the *worst* thing about puberty other than periods?	0
"Women who have relatives the same age (siblings, cousins) where one of you became successful and the other one unsuccessful, what happened?"	0
Do older women ever actually get with younger males?	0
What is love?	0
"For those who went through a tough time with their SO that required forgiveness, what was the situation and how did you overcome it?"	0
In what non-abusive ways did your parents cause long term damage?	0
"I'm pro-choice but I lost a debate with a pro-life, can someone help me rebuttal this?"	0
"Women who have broken off a long term relationship, what was the moment you realized it was over?"	0
breast size change?	0
What kind of porn do you like to watch when you masturbate?	0
Women of reddit who were deemed by their SO as too attached or clingy. How did you change?	0
"AskWomen, how do you sound when you're singin' the blues? Sing one of your favourite sad songs and post it!"	0
"Those who have done food sensitivity testing, how was it and how accurate was it?"	0
Does anyone on AskWomen like sports?	0
What type of exercise do you absolutely love?	0
All these 'red flag' questions are so negative! Would any women of reddit like to share a story where the date went a lot better than expected?	0
What are some physical features or general attributes about a guy from across the room that could excite you right off the bat?	0
"On a date, which questions would you like to be asked?"	0
What was an unexpected shock or surprise what you traveled somewhere?	0
What’s the worst job interview that you ever had?	0
AskWomen Community Survey	0
What are some cute alternatives to saying goodnight?	0
"Women with traumatic pasts, bad past relationships, or trust issues in general - how did you learn to fully trust a new and wonderful partner?"	0
"How common is... ""The Ramp""?"	0
"Married women of Reddit, how old are you and how many boyfriends/partners did you have before marriage ?"	0
"Ladies, what's your favorite Beyoncé song?"	0
"How do you deal with people saying you only like your hobby (video games, sports, weightlifting, etc) to get attention from men? Especially them dismissing all the effort you’ve put into it?"	0
"Other than career, what steps can a single person take to present oneself as ready to settle down and make the idea attractive?"	0
What is pretty girl privilege? Have you ever used your ‘pretty girl privilege’ ? Explain the time	0
"Women of Reddit, if you could send a letter back in time, what advice would you give to yourself 300 million years ago when atmospheric oxygen levels peaked at 35%?"	0
What are your go-to clothes?	0
"What are you open about on Reddit, but rarely talk about in real life?"	0
What's your biggest failure in life?	0
Is a man very close to his dog unattractive?	0
Have you seen Sarah Stage's baby bump? Or lack thereof?	0
What is your opinion on quote tattoos?	0
"Despite the stigma, why do females still chose to get lower back tattoos?"	0
"If most gay male porn were made for women (like most lesbian porn are made for men), what do you think gay porn would be like?"	0
What food brings your mind home?	0
"As a male college student who doesn't want his peers to suffer sexual assault, how can I look for signs of it and do my best to prevent or stop any instances (at parties, for example)?"	0
What’s your opinion on wearing a sports bra as a top at the gym?	0
"Women who practice martial arts, proudest match you've fought?"	0
Why do you like tattoos on men?	0
"Does anyone else ever feel ""responsible"" if their friends aren't having fun at something they chose to do/didn't like the food at a restaurant they chose, etc?"	0
"Those of you who have committed adultery against your partner, why did you do it and how did it turn out for you and your betrayed partner?"	0
How do you respond if you learn your So cheated her/his ex-partner?	0
"Women who have witnessed or had a disaster wedding, what happened??"	0
Ladies do You Like When a Man Gives You Flours?	0
How do you deal with that annoying coworker?	0
"Women who have regretted a breakup they initiated, what is your story and what did you do about it?"	0
What was your wedding venue like?	0
Why do you love your SO?	0
When have you been really mean to someone and regretted it later?	0
"Women of Reddit, Wich male body type do you find the most attractive? Muscular, athletic, thin, chubby or fat?"	0
"We all know how words like ""bossy"" and ""shrill"" are disproportionately used to describe women. What are some other words you hate because of their gendered slants?"	0
How did you know when your bestie became your bestie?	0
Have you been a creep to someone? When did you realize it?	0
Favorite podcasts about personal development/self worth/relationships etc?	0
What's your favorite thing Toni Morrison has said or written? What have her words meant to you?	0
What's something you wished your SO knew but would never want to tell them?	0
Why do all women have different opinions?	0
"Women of Reddit, who is “that person” who is currently making life more awesome for you?"	0
"Women who wear a lot of makeup, why do you do it? And are you comfortable in your own skin?"	0
What do y'all think of Beyonce's latest album?	0
Why are romantic movies full of so many toxic relationship ideals?	0
Have you ever noticed you were being followed? If so how did you react and what was the outcome?	0
What's the love story of a couple you know (or know of) who makes you believe in love?	0
Would you like to be a traditionally 'submissive' wife?	0
"Saw ""Mean Girls"" couple of days ago, how common were girls like regina in your life or school?"	0
How do you enjoy sex when you're not attractive?	0
How would a woman react if I told her not to wear make-up?	0
What percent of the population is attractive to you?	0
Broken after a breakup: what are your self-care tips?	0
Hey ladies! How do you feel about porn and what so you like to watch? Is there any genre that offends you or turns you off?	0
What is the one thing that you are the most proud of yourself for?	0
"Ladies who lost weight, what’s something that really changed the game for your weight loss journey?"	0
"What is your ideal relationship structure? Monogamous, polyamorous? Do you think conventional relationship structures are outdated and unrealistic?"	0
"Is the whole ""save the world and get the girl"" trope/fantasy sexist to you?"	0
What did your partner do to give you the best organism you ever had	0
"Ladies, what hobbies do you find a major turn-off coming from a man?"	0
Thoughts on freckles?	0
What's the most surprising fact about you?	0
"What is/was your opinion on the sub, /r/fatpeoplehate, which has been banned?"	0
Do you accept random boob-grabs/fingering from your SO?	0
What’s your favorite outfit to wear?	0
Why do women seem to not like video games as much as men?	0
"Ladies in their late 20's, do you any of still live at home with parents? If yes, for what reason? How has it affected your sanity?"	0
"Since Bernie may not be an option, Please submit Top 5 reasons you think one should vote for Trump or Hilary?"	0
"The internet always mentions the wholesomeness of Bob Ross, Keanu Reeves, Tom Hanks, and Mr Rogers, but who are the wholesome internet women?"	0
Does it bother you that women are very often referred to as girls even in mature and sexual contexts?	0
What is your try on nightmare story?	0
Be honest: what did you do wrong in your last failed relationship?	0
Has a significant other ever criticized your weight? Did it encourage you to change your appearance? How did their comment affect your relationship?	0
"Women of Reddit who didn't want to but ended up having kids, what was your experience like?"	0
In order: what is the most important factors to you as a woman when looking for a mate	0
"Women in the army, how did serving change you?"	0
How does it feel like to be labeled as pretty?	0
What is an issue or topic in the news or social media that you are tired of hearing about?	0
When do we know that she's a player and that you should avoid her at any cost ?	0
Why don't you vote Republican?	0
Why do women want to go through the pain of childbirth more than once?	0
[Final Update] A potential employer made a sexual joke during our e-mailing back and forth. Bad sign?	0
When did you start prefering to stay in and sleep/relax rather than go out?	0
Have you ever been pursued (romantically) by a teacher? How did you react?	0
When did you realize YOU were the one?	0
What is a book that has shaped you into the woman you are today?	0
Have you ever been gaslighted by a boss and how did you deal with it?	0
"(Male here) Women, what do you want out of life in the grand scheme of things?"	0
What are the early signs of a one sided relationship?	0
Any women brave enough to post a before and after make-up photo? (Inspired by the porn stars without makeup post)	0
"WOC, what's your experience with ""rape culture"" with in your own culture?"	0
How do you get used to living alone and being single?	0
What do you think of Indian foods?	0
"How do you feel about the use of the word ""guys"" to address a group that includes you?"	0
How did your SO convince you to become non monogamous? For those who were monogamous earlier.	0
"What do you have in common with the other women in your family, what is something about you that is very different?"	0
"AskWomen, how has heteronormativity personally victimized you????"	0
"The co-founder of Tinder is creating a ""women-first"" dating app where women must make the first move. What are your first impressions of this idea?"	0
why is vaginal stimulation so much more common then anal stimulation? how different is the feeling?	0
"Gym goers, do you have any women specific tips for those of us with ""new year new me"" gym resolutions?"	0
What are you thoughts on tolerating unhappiness or marginal unhappiness in a relationship for the sake of financial security?	0
How do you feel about Trump entertaining the idea of buying Greenland?	0
What are some dating myths you’ve found that some guys tend to believe?	0
How do you prevent yourself from melting into a lazy puddle of goo the moment you walk into your home after work?	0
Women: what are some of your horrible experiences with tampons?	0
Is going to a concert with a guy acceptable when you're with someone else?	0
What do you ladies think about the allegations against Aziz Ansari?	0
What is that perfume that smells like cotton candy?	0
How did people treat you after you bought a fancy car?	0
"What fictional relationship just screams ""male fantasy""?"	0
How tedious is the drying process in hair dye?	0
"""I love pale girls"" Why do I find this comment so iffy?"	0
"I am an overweight man (about 240lbs) who is actively trying to lose weight. Would you consider dating me, or should I lose more weight before asking girls out?"	0
How many people have you slept with? Does it bother you? Do you tell your potential partners even if you don't have an STD?	0
Single Dad here. How can I show my daughter how to do the hair/towel wrap thing?	0
"How much money do you spend per week on groceries, and how many people are you feeding with the food you buy?"	0
What makes a woman shallow?	0
What are effective ways to flirt with someone you’re dating? (What’s something you specifically like)	0
"The US Treasury today announced that they are replacing Andrew Jackson on the $20 with Harriet Tubman. What are your thoughts on this, if any?"	0
Ladies of reddit: what's your side hustle?	0
What's your worst friendship break up story?	0
"Break down yourself into data sets; height, weight, IQ, band size, age, etc. Which two data sets would you exchange if you could and why?"	0
How do you deal with or process micro-aggressions?	0
"If you were given $5,000 today, what would you do with it?"	0
What is the hardest part of the first year of marriage?	0
"Of the times he/she didn’t text you back for days at a time, how many were because they actually had a life emergency?"	0
"If you have never masturbated, why not?"	0
Who would you like to see win the Democratic nomination?	0
Is it common to control period with birth control pills? Any side effects?	0
Women who are conventionally attractive: Do you have any stories where your attractiveness has actually been a disadvantage in your career (or your life) ?	0
"Women who made the personal choice to not date in high school, why?"	0
How do you feel about handwritten love letters from a significant other?	0
"Gay women of reddit, how do you meet other lesbians or bisexual women? Do you use dating apps?"	0
Ladies. Who is a really attractive male to you in terms of pure beauty.	0
"Ladies, what is the best way to strike a conversation in the gym with you and ask your name without seeming creepy?"	0
"If someone were watching your life like it was a movie, at what point would they have gone ""oh, come on, why would you do that!?"""	0
How can you tell whether you're in love with someone or just in love with the idea of being in love?	0
"Ladies, is it ok for a man to like feminine, or ""girly"" tv shows or movies?"	0
Has anyone been in an abusive relationship but didn't realize it until after the fact?	0
What do you wish you would have known about getting married before saying “I do”?	0
What happened that brought you to the realization that you knew something had to change?	0
What does it feel like to date a guy who has a good job and provides for you?	0
What's it like having a healthy relationship with food?	0
What kind of situation could be normal for men but weird for women?	0
How can a guy compensate for his looks?	0
"Hardworking women of Reddit, how did you become hard workers? From, a regretfully lazy girl."	0
What kinds of oils do you like to use for skin/hair/body care? How do you apply it?	0
What would misconceptions about female sexuality would you want to clear up for a teen girl?	0
"Ladies of reddit, how do you feel about tall skinny guys?"	0
Those in a relationship with the opposite “-vert”: How do you make it work?	0
What makes a man physically unattractive to you?	0
"Mothers of AskWomen, what are some of the ""mom things"" that you thought you would never do but ended up doing it anyway?"	0
What does your favorite pair of earrings look like?	0
"Dear women, something I have always wanted to know but too afraid to ask: how do you shave down there with out something gruesome happening?"	0
"Pornwatchers, what do you like about the porn you watch?"	0
What steps could an employer take to reduce the wage gap along their employers?	0
Anyone here ditch a career in STEM/academia for more creative pursuits or non-academia? How'd it go? How'd you make the jump?	0
What is your favourite feel-good PMS movie ?	0
"Why is the word ""Cunt"" so offensive?"	0
What's the best thing a guy has ever done for you?	0
Do you ever get told that you look like your mother? How does that make you feel?	0
"Which of the movement arts is your favorite to watch and what do you love about it? If it differs, which is your favorite to do yourself?"	0
What is a flaw in your SO that you can overlook because you love them?	0
"*trigger warning* - Should consideration of the woman's ""character"" be off limits during criminal trials for alleged sexual assaults?"	0
What wine pairs best with raw cookie dough?	0
How often do you hate being a woman because of your body and your bodily functions?	0
(NSFW) What have you found out about someone that you would never tell them you know?	0
What's an experience that changed your life that no one wants to hear about?	0
"women of reddit who have experienced a break-in at your home, what was your form of self defense?"	0
How would you react if your friend asked if they could propose to their partner at your wedding?	0
Do you think the men who are in a tizzy about 50 shades of Grey are maybe threatened by the concept or feel insecure because of it?	0
Why do some women have sexual relationships with partners that hate cunnalingus?	0
"Women with anxiety, how do you stop chronically overthinking small things?"	0
How do you pick yourself up after a personal failure?	0
Have you ever had a Glo-up and how did you do it?	0
What's the harshest thing you've ever said to a significant other? Do you regret it?	0
What kind of secret society would you like to start?	0
What are your top five favorite movies of 2019?	0
How does the over sexualization of women's bodies relate to rape culture?	0
At what age did you meet a partner that made you believe another human being can be a trustworthy partner in life?	0
"If you were able to run DeepFakes software on your computer, what would you do with it ?"	0
"What is a book that helped you through that awkward phase in your 20's where your friends are all hitting milestones at different rates, you feel like everyone thinks you should be future-focused, and you just generally are struggling to find your groove?"	0
"Women who decided not to have a dog, what made you decide that?"	0
"Working women with no kids, what is your social life routine like? How often do you see your friends and balance each friend group with your exercise, SO, or daily life?"	0
How do you feel about inauthentic compliments? Do you think people give them out often?	0
I just ate a whole box of mac and cheese for breakfast. What shameful thing have you done this week that you aren't ashamed of?	0
"What are some great cooking tips for someone in college, you wish you knew earlier?"	0
Girls in the US have been getting higher grades than boys at school and university for nearly a century Why Do you think that is?	0
"Women of Reddit who have had abortions in a committed relationship, how did it affect the relationships between you and your SO?"	0
What are some methods to sleep and eat better after a break up?	0
Am I truly a bad person for not wanting to date girls that don't care about The Legend of Zelda?	0
Have you ever felt resentment towards your SO? What’s your story?	0
What weird things has a doctor said to you regarding your body?	0
"For anyone who lost their virginity to a friend or someone in their social circle (but not a boyfriend), how do you feel about it now?"	0
"How have you handled ""the right one but wrong timing"" situations?"	0
"Women who have been raped by women, how has your life been affected?"	0
What is the story of your best sexual experience to date?	0
"Why is Reddit SO anti-fat, especially anti-fat women?"	0
Married Women of Reddit - What one thing could your SO do that would instantly make you happier in your marriage?	0
"What's the purpose of pantyhose, beyond aesthetics?"	0
How do you not be too hard on yourself for realizing you tolerated poor behavior in a relationship?	0
What’s the craziest unrealistic expectation you’ve seen someone (whichever gender) have for their potential partner?	0
"Have you ever fell in love with ugly man(woman)? What was the reason? If the relationship is still going on, how it is going on?"	0
"Former misandrists, what prompted you to have that point of view, and what made you realize that it wasn't the way?"	0
What are your favorite 4 ingredient or less recipes to make when camping?	0
"Women, at what age did you peak in physical attractiveness?"	0
I just learned that Quizilla is no longer around. Anyone else spend their tween years taking stupid quizzes?	0
How did you re-invent yourself and become who you truly wanted to be?	0
"In Charlottesville, the police refused to protect a synagogue next to which armed Neo-Nazis were marching and making threats. Do you think the police should have protected those at the synagogue? Why or why not?"	0
When did you stop holding on to certain toxic things in your life?	0
What do you think of men whose hair is longer and more beautiful than you do?	0
Would you ever let a friend borrow money from you? Why or why not?	0
"Antifeminists of AskWomen, why are you against feminism? Feminists of AskWomen, why are you against antifeminism?"	0
What should I be asking my mother before she dies?	0
"How do you learn to accept that a relationship is over, and they're never coming back?"	0
How does kissing a woman compare to kissing a man?	0
How often do you think about fucking those around you?	0
"What would reddit be like if 50% of the admins, mods, and users were women or genderqueer folks?"	0
"Woman who have gone from looking dumpy to professional, how did you do it?"	0
What topics within your hobbies are the subject of vitriolic debate?	0
How many years do you keep clothes you don’t wear in your wardrobe before deciding to donate or throw them away?	0
"How much would you estimate you've invested into safety as a woman? If at all, what exactly have you invested in?"	0
What (if any) animated male characters do you find sexually attractive?	0
What's your biggest pet peeve?	0
What are some of the most ridiculous examples of bad design without women in mind?	0
A 14 year old riding his bike just slapped my butt as I was walking. What the fuck would you have done?	0
"Unattractive women, what is the worst social experiences you’ve had due to your physical appearance?"	0
what's the weirdest thing thats ever come out of your vagina?	0
Have corsets become the awkward nerd girl's fedora?	0
What is your favourite “useless fact”?	0
"Married women, at what age did you get married?"	0
Why might a question receive hundreds of responses yet 0 upvotes?	0
"Women of Reddit who went back to school later in life, how did you afford it?"	0
When do you feel the most feminine? When do you feel the least feminine?	0
How do you deal with an insecure partner that struggles with trust ?	0
"What would you do if a guy said to you ""Listen baby, I think you know what time it is... It's time for analingus""?"	0
"Ladies, what are some positive interactions you've had with a male?"	0
What do the ladies of Reddit think of Game of Thrones?	0
"Is it a turn-off if a guy finds these snarky, circlejerky parodies of questions really annoying?"	0
"Women of Reddit- if you had to pick, would you rather have a partner that you perceive to be more or less attractive than yourself? Explain your answer if you can and thank you"	0
"What's your favorite part of your SO's body, besides the obvious?"	0
"Ladies, how did you end up having FwB?"	0
"Women who smoke cigarettes, what made you start and how long have you been smoking?"	0
How does it feel to know that there are pornstars out there that look like you?	0
"Women who work for companies with a liberal WFH policy, how often are you in your offices if you don't absolutely need to be?"	0
What is the biggest adjustment you experienced when you moved in with an SO for the very first time?	0
Those of you who have friends or family members who voted for Trump. What are the most common reasons you've heard for supporting him? What are the most outrageous reasons?	0
"Would you spend a year in north Korea for $99,999? Why or why not?"	0
"With most of Hollywood output being by and from a male POV, what are some good movie/TV scenes featuring realistic seductions or courtships from a woman's perspective or ""female gaze""?"	0
Stories of intuition? Please share.	0
"Do you or anyone you know or know of go out to a bar to ""score"", the same way a man does?"	0
"Women who have thick, long and healthy hair, what is your secret?"	0
What is an instance you can think of where you have been sexist toward a man?	0
How do you have you desk set up to promote good posture and avoid wrist/neck/shoulder problems?	0
"So, do women breathe through their lungs or do they have gills?"	0
Which muscle group in males is the most attractive?	0
What's a memory from your childhood that sticks with you despite it being totally mundane and uneventful?	0
Does anyone else feel like their face attractiveness fluctuates daily?	0
"Women of Reddit, what is your “guilty pleasure” when it comes to spending?"	0
Who's someone who isn't a conventional beauty but still charmed you?	0
How should both people in a relationship communicate? How often? Should one be the conversation starter more than the other?	0
"Do you think ""thin priviledge"" is a thing?"	0
What is just not worth your time or energy anymore?	0
How attractive is ambition and goals to a woman?	0
What’s the worst/funniest pronunciation of a word you’ve ever heard?	0
"Have you ever ‘worked on yourself’?, if so: how?"	0
"Women, what effects does the pill have on your mood?"	0
What do you get if you mix a rabbit and a snake?	0
"Crafters of reddit, what are some new projects that you are working on?"	0
