Questions	Male
"If you've been the one to end a close friendship/initiate a friendship breakup, how did you go about doing it?"	0
What should u know before losing ur virginity?	0
Are any of you also really tired of friends constantly staring at their phones?	0
"Girls, what is something about men which makes you realize they will probably be a dud boyfriend over time?"	0
How do YOU make female friends without having a hobby?	0
What does your SO sacrifice for you?	0
"We don't often hear about women being turned down, what's the most annoying rejection you've had?"	0
What are some of the ways to become an interesting person?	0
"What was the moment you realized your SO really, truly loved you?"	0
For what reason would you tell someone you missed them when you didn't mean it?	0
What do you hate most about catcalling?	0
What name do you really love but would absolutely never name your child?	0
"We're encouraged to marry ""before all the good ones are gone"". In your experience, when did ""all the good ones"" start really going?"	0
How do you move on from past mistakes?	0
"Women posters to r/gonewild and other nsfw subs, do you enjoy the comments that are posted?"	0
"Ladies who had a friend play ‘matchmaker’ for you, how did that turn out?"	0
What makes your family dysfunctional?	0
Any tips for how short guys should gain confidence with women?	0
"Older women of Reddit, what issues do you see with the younger generation of women in today's society?"	0
What do you guys think about sex while on your period?	0
"Black ladies, how do you find men who are interested in serious relationships/marriage?"	0
What do you think about gamergate?	0
"Women of Reddit who have careers/jobs that require you to be on your feet all day, how do you manage foot and leg pain?"	0
What offends you the most?	0
What do you think about unsolicited duck pics?	0
"Ladies, what are your thoughts on 'social surrogacy?'"	0
"How old were you when you realized that the world was a dangerous place for women, and what happened to trigger that realization?"	0
What is something that you think is obvious about yourself but you find you have to explain it to other people often?	0
How do you find inspiration?	0
Why do women need purses but men don't?	0
How do you feel when you are hanging out with your friend and she is hit on by a guy?	0
Who on It's Always Sunny in Philadelphia do you find to be the most attractive?	0
What’s something you can’t live without at home?	0
Women in committed relationships: how often do you get crushes on other people?	0
How does it affect you when people post hetero normative questions on here?	0
How do you stop feeling sorry for yourself?	0
How do female athletes deal with menstruation during a big sports event?	0
What are some beauty/hygiene tips you would give to a guy?	0
What is your favorite feminist or pro-women song/anthem?	0
"When, according to you, is sex good sex?"	0
"Women who've received a phone number from a stranger, what is your probability of actually contacting them?"	0
What's the worst place or context you've been hit on?	0
"What is the weirdest example of a product made ""for men"" or ""for women"" that did not need to be gendered at all?"	0
"How did dressing up nicely everyday and self-care change your self image, relationships (with yourself and others) and outlook on life? What are your favourite hacks?"	0
"Women who have SUPER heavy periods, How do you deal with it?"	0
"What is something your mother taught you (tip, life hack, etc) that you will most likely pass along to your daughter?"	0
My period just leaked on my office chair. Help!	0
Would you be offended if a guy did not trust you with a used condom?	0
"Married women who didn't meet your spouse until ""later"" in life, what was your experience like?"	0
"Women with giant everyday bags, what's in your bag?"	0
what is your love language?	0
What do you do when you lose yourself in a relationship?	0
How do you groom your hair during the time you haven't washed it?	0
What's the worst well-inentend romantic gesture a SO ever did for you?	0
How & when did you finally get used to being single after getting out of a serious long term relationship?	0
Gals- I am a broke uni student who isnt feeling too pretty. What are your cheap & quick tips for feeling more put together?	0
How long did it take for you to be interested in someone you ended up dating for a while?	0
What was your best sexual experience?	0
what does 'feminine' mean to you?	0
"If you would recommend one novel for everyone to read, what would it be?"	0
"Ladies that prefer guys on the bigger side, have you ever encountered misogyny when stating your preference?"	0
How skilled are you at eating with chopsticks?	0
"Women who had kids, how does pregnancy and labor feel like?"	0
What glorious thing took you far too long to discover?	0
"Women, what do you think is the equivalent of a ""red pilled guy"" but for women?"	0
Where in the world have you felt the most unsafe and why?	0
What song does your SO hate and do you use it against them?	0
What are things that skinny women with high metabolisms can do to gain healthy weight?	0
What are some “life essentials” you’d recommend?	0
What movie character do you identify yourself as?	0
How short would you say is too short when it comes to shorts (men's & women's)?	0
What subtle/relatively SFW thing has somebody said to you outside of the bedroom that really turned you on?	0
Could you like a shy guy?	0
"Is it appropriate to have sex on the first gate, or should you wait till the second, third, etc?"	0
What is a bad habit that your spouse has that you just had to eventually accept as appart of who they are?	0
What do you think of live action Lady and the Tramp being announced?	0
"Today is International Women’s Day, we’ve got a long way to go, but in your lifetime what are the changes you’ve seen that have made life better for women?"	0
"Ladies, this might be a bit too controversial, but what do you think the difference between body positivity and normalizing obesity is?"	0
"What are your favorite easy, plant based meals?"	0
How did you move on while still living in the same city where something happened?	0
To what extent do you think “pretty privilege” is a real thing?	0
How tidy does your house stay when no visitors are expected?	0
"Thin women, where do you find clothes that fit?"	0
"Ladies with an Avoidant Attachment style currently in long-term relationships, what made you choose your SO?"	0
how would you feel if you found out your bf fap to other girls but not to you?	0
What women over 30 do you admire?	0
"Women of reddit, how do you ask for a raise?"	0
"For those of you that explored polyamory/non-monogamy while already in a long term relationship, how did you bring it up and get started?"	0
What's the best piece of advice you can give to the father of a little girl?	0
"So I don't drink,smoke, or do drugs. Is that weird? =/"	0
Are women basically choosing their socioeconomic status when they decide who they want to marry?	0
Do you think Misogyny is still strong in American society? What is the most misogynistic thing you have personally witnessed?	0
How has age changed your view about sex?	0
"Ladies who swallow, how is it and what does it taste like?"	0
How often do you trim your hair?	0
What is your Zodiac sign?	0
Those who have financially supported your S/O. How was the experience? Why did you decide to do it? What was the hardest part.	0
What’s the dumbest thing you fought with your sibling(s) about when you were younger?	0
What is the funniest thing you've seen a cat do?	0
Curvy folx! Where do you buy your jeans/pants?	0
How do you feel about the treatment of Beyonce over on the Reddit homepage? 	0
What was the largest thing you've carried in your purses?	0
"Feminist-conscious women, what dreams and wishes do you have, that you question or dismiss as archaic traditions / conditioned gender role?"	0
"Women with depression, how has it impacted your decision about whether or not to have children?"	0
How do you feel about a man who moans during sex?	0
What something do you wish society would celebrate more about women?	0
What are some things you learned from nannying or babysitting? What would your tips be for others?	0
What are some of the most common mistakes men make in bed?	0
"What are the questions that can be asked when the interviewer asks ""Any questions?"""	0
What's your apartment search tip?	0
What trends did you notice in the people you dated?	0
"Whelp, I just read a job posting for an ""entry level"" position that required 4-6 years of experience. I'm done for the day. What's boggled your mind and/or frustrated you today, AW?"	0
Where do you put your things at the gym if there are no free lockers?	0
Do you send nudes to guys? Why or why not?	0
Is it me or do men seem to show less respect and manners towards women these days? What are your experiences?	0
Hello ladies. I have a question about bra sizes and boob size. Why is it that two women can have the same bra size but have noticeably different breast sizes?	0
"Mothers of Reddit, were you ever worried about loss of identity associated with having kids? How did you overcome this?"	0
What helped you with your insomnia?	0
Why are Americans often so vocally proud of being American?	0
Do you distrust men around children?	0
Am I an a-hole for saying this?	0
What’s something you had to learn the ‘hard way’ and now want to share with others so they don’t have to?	0
What are some good porn sites for straight women?	0
"Which country has thr best food, in your opinion?"	0
How best to greet a women you’ve never met on a first date?	0
Is it ok to tell a girl she has a nice figure?	0
What are your thoughts on the Taylor Swift/Calvin Harris drama that's currently unfolding?	0
Women of ask women how much Sex is too much sex?	0
"Women who have consumed hard drugs, how much did they affect you financially, physically, and legally?"	0
"Those of you who have taken a martial arts class with no prior experience, what was your first class like? Also what martial art did you take?"	0
"Women living in saudi arabia, what's it like?"	0
Which animal's mating ritual are you most glad is NOT the way WE seduce each other?	0
What stereotypes of Asian women specifically are you tired of seeing portrayed in media?	0
What would your reaction be to a guy who had limb lengthening surgery to grow taller?	0
What is your favorite position to receive oral sex?	0
"Gonna be honest here. Does anyone else feel like vaginas are kind of, like, weird?"	0
"Is the term ""you guys"" offensive?"	0
How do you reconnect with friends after you've isolated yourself due to depression/anxiety?	0
"Ladies of Reddit, what new dating dealbreakers have you developed as the result of a failed relationship?"	0
Ladies who once feared their SO was merely settling for them: what incident proved you wrong and put those fears to rest?	0
"Women, have you every tried the menstrual cup, if so how'd it work for you?"	0
What are the characteristics of your best lover?	0
"Women who live/lived alone, what are your tips for feeling safe?"	0
The Twilight Saga: How much did Edward being a vampire influence your enjoyment of the series?	0
What is something that is genuinely all right to hide from an SO?	0
"Women who forgave their partner for a massive fuck-up and stayed in a relationship, how did it turn out? What was it?"	0
Why are most sex workers female and most clients male?	0
"If you're trying to kill off a text convo but are too polite to ghost, what are hints you send out that the guy should recognize?"	0
From what sexual position do you receive the most pleasure? (Xpost from Askmen)	0
What are some good tv shows/movies/general entertainment without ANY sexual assault scenes?	0
When did you realize you were funny and how do you think having a good sense of humor has helped you in your life?	0
"Have you ever wondered if there was more to life, other than being really, really, ridiculously good looking?"	0
What little things do you do to make your house feel more homey?	0
"Women of Reddit, what is the cringiest fandom you've been a part of?"	0
"What is something that made you say, ""Okay that's enough Reddit for today""?"	0
What female character in tv or film is obviously a male fantasy?	0
"Women who live abroad, what is something of that country you can't get accustomed to?"	0
What's the pettiest reason you've dumped someone?	0
What is the female equivalent of Fight Club?	0
Women who suffer with anxiety without access to therapy... what are your coping strategies?	0
How many social network platform do you use? What are them? How active you are at those?	0
What do you think is the female version of a neckbeard?	0
"Women of culturally restrained countries, how often do you fantasize about romantic male interaction?"	0
What are the dos and don'ts of staying as friends with an ex from your personal experience?	0
What do you think of Louis CK's apology?	0
What did it take you to finally forgive the person who cheated on you?	0
What are some good/decent paying entry level jobs?	0
What masculine traits were you encouraged to take on when entering the workforce?	0
What makes you decide what parts of your body to shave and not shave?	0
How Do You Deal With “Unwanted Advances”?	0
What do you think of guys that wear shoes with laces?	0
What is a trend that you actually enjoy?	0
"Women of Reddit, where do you go for the dankest memes?"	0
"What is the best technique for giving a good breast massage? In my experience, girls seem to like it when I push their breasts up and/or together, but not when I pull down. What do you think ladies??"	0
Have any of you taken a chunk of time to intentionally not date and focus on yourself? What did you do during that time for fun and/or self improvement?	0
"Best use of boobs so far, beside breastfeeding/sex appeal?"	0
How do you become okay with never being able to find a relationship?	0
"Women who love themselves and have high confidence, how do you do it ?"	0
What do you do to stay safe while running or biking outside by yourself?	0
Do you wish men would also get periods?	0
"Women of Reddit, what are your thoughts on becoming a sex worker?"	0
Posters of AW: what do you look like?	0
"Have you ever been out with someone where you thought it was a date, but they meant it as friends? What’s your story?"	0
How do you go from being a slob to being a highly self disciplined person?	0
What is your favorite hot sauce? And why?	0
"Ladies who have gone your natural grey (hair), how did you do it? Let it grow out, had some kind of process done, etc.? Are you happy with it?"	0
"Ladies, What are some things your SO does after sex that makes you happy?"	0
"Has anyone ever tried the 9/80 work schedule? If so, how did it go?"	0
What’s the best/most satisfying snack while on your period?	0
How have you helped you SO to be a better feminist?	0
What do you think about the attitudes of the SRS community 	0
"(NSFW) Ladies who have have given birth naturally or had a cesarean, what is your best post-partum recovery tip?"	0
What is your favorite meal to cook?	0
Is anyone exhausted by the constant maintenance and grooming 'required' to look and feel good?	0
What’s a skill you’ve gained from watching YouTube videos?	0
How does one identify the point of too much compromise?	0
"Those of you who remove your pubic hair, how do you remove the hair that's closer to your vagina? Do you fully remove it or just trim it?"	0
Have you ever wondered what it would be like to jack off?	0
My dog was cat called on our walk tonight. How do you feel about cat calling spreading?	0
"Following on from the “Why don’t you get a man to do that” thread, what was your worst experience of being told “You’re a woman so you should do that”?"	0
"Woman who have organised fancy gender reveal announcements or events for their child, why did you decide that it was something you wanted to do?"	0
Do you see red flags in the romantic relationships of any of your friends? What are they and why doesn’t your friend see them?	0
"Women who went from very dysfunctional relationships to a very healthy one, what was the biggest surprise/eye-opener?"	0
"Women who started their relationship as ""the other woman""- does it ever cross your mind that your partner will find another ""other woman"" when committed to you? How do you stop your mind from wandering?"	0
What are the signs that you're in a codependent relationship?	0
"AskWomen, what is your favorite TMI period clot story?"	0
We’ve heard a lot about bachelor pads. What’s in your dream bachelorette pad?	0
What online service is worth the monthly fee and why?	0
"Ladies, how old are you and how many guys have asked you out in your life?"	0
How do you respond when your SO is taking too long to message you back?	0
How do you know what exercises to do at the gym?	0
"Would you be offended if your boyfriend asked you if you were ""PMSing"" when he thought you salty?"	0
What is the worst interview question you have ever been asked?	0
What are your favorite guns and why?	0
"If you have cod liver oil, which brand do you have? Have you seen any beneficial effects?"	0
What's the most 'Black Mirror' thing that's actually happening?	0
How do you feel about the US women's soccer team getting equal pay? What reasons do you think it will/won't happen?	0
What is the difference between a women saying she wants a man of a certain height and a man saying he wants a woman of a certain figure?	0
What are some things you do while making out to make it more intimate?	0
"Guy here, how do bra sizes work?"	0
What is your embarrassing bad habit?	0
"Ladies who were bullied because of your looks, when was the first time you realized someone was genuinly attracted to you?"	0
"be honest, how would you feel about dating a man with no close friends?"	0
Introverted mothers of reddit -- How do you deal with constant need of attention from your child?	0
"Those who have listened to Serial and/or undisclosed: What do you think of Adnan Syed, and why?"	0
"Women of ""AskWomen"": do you feel that readers of AskWomen all too often act like they want women's opinions, but what they really want to do is disagree with and downvote them?"	0
Do you ever walk in on other women taking selfies in public restrooms? What goes through your mind when this happens?	0
When did you realize you (or your partner) were staying in a relationship based on comfort?	0
"The supplemental rules for ""Mate-Free Monday"" are now in effect."	0
Can any ladies post pictures or describe your idea of a physically attractive <non-white ethnicity> male?	0
"Thoughts on the portmanteau trend of man + action: e.g. Mansplaining, Manterrupting, Manspreading, etc?"	0
"What are some female character written by a male writer moments that made you go ""This guy is so out of touch with women""?"	0
What is everyone’s opinion on life after death? Interested to see others beliefs and conspiracys	0
"21 year old male never had a relationship, got no friends how f***** up am I? "	0
Do you think guys are supposed to be 'tough guys'? Would you think less of a man who was afraid to fight?	0
What is life like as an unattractive women?	0
"Women who have decided not to have a dog, what made you decide that?"	0
What do you miss about your 20's? What don't you miss? What do you wish you did in your 20's? What do you regret?	0
Anyone else hate make-up? Or is it just me?	0
How much of a difference does the size/quality of a man's lips make when it comes to kissing?	0
"Have you noticed a gender spilt on Spotify's Discover Weekly playlist? If so, why does it exist?"	0
"What's the most infuriating thing a man has tried to ""mansplain"" to you before?"	0
Happy International Women’s Day!	0
"Those who work in tech/science fields, how do you deal with people who are (or who act) smarter than you? Also, how do you deal with condescending comments and anxiety over not being smart enough?"	0
What according to you are some of the best questions to keep up a conversation?	0
"If your workplace was a sitcom, how would you describe your coworkers’ characters?"	0
Have you ever gotten “bad vibes” from a friend’s SO? Did you tell your friend? Were you ever proven right or wrong?	0
"Every time I see a guide dog working out in public, I get overwhelmed with emotion and cry a little. Ladies, how can you literally not even?"	0
What was something NOT NORMAL about your childhood that you only realized in hindsight?	0
What is the strangest thing you did in front of your crush?	0
What made you fall in love with your s/o and how long did it take?	0
What did you feel after being cheated on?	0
Women of reddit - what's a hobby you took up later in life and managed to become pretty good at?	0
"Investigators, what was it like finding another girl's hair as evidence of cheating?"	0
"Dog/cat parents, how do you keep your home smelling good with minimal pet odor?"	0
"People who are naturally introverted, how did you become more extroverted?"	0
The guy I've been talking to just admitted to LOVING Star Wars. I suddenly find him a bit less attractive. What strange things have turned you off lately?	0
Can you recommend a good book that doesn't have a straight white person as its main character?	0
"Ladies who have struggled financially: my mom has always said, ""it's expensive to be poor."" In what ways have you found that it actually costs more to have less?"	0
Ladies! How AMERICAN are you today!?	0
What question do you wish I would have asked instead of this one? What would your answer have been?	0
"What can men who think they are too ugly to successfully date do to attract the opposite sex, in your opinion?"	0
How do you stop yourself from crying when you feel like you're going to cry in front of colleagues etc?	0
What’s something cute you’d like your S/O to call you?	0
"Women who often have people over, what tips do you have to make your place more inviting?"	0
What do you think about the fake pregnancy announcements on April fools day?	0
How have you been targeted for being “pretty”?	0
"Ladies of reddit what is your ideal mate(looks,personality and quirks)and how has this changed from when you were younger?"	0
What is the “open secret” at your workplace?	0
What if mothers could choose between legally-enforced paternity support and the right to an abortion?	0
Anyone else get dizzy kissing their SO? (Or even THINKING about kissing their SO?) Why does this happen and does it ever go away?	0
Why are tampons and pads made for different flows?	0
"Women who regret having children, why?"	0
"Women who have slept with a lot of men, what are your surprising insights?"	0
"Ladies who met their SO in their 30s (or beyond), how did you meet? And did you have any worries before you finally met them?"	0
"I have been feeling kind of depressed about all the bad news going on in the world, what are some good things that are happening, that the news isn't covering?"	0
"If you could force all men experience one aspect of being a woman, what experience would you give them?"	0
What's weird about your body?	0
"What were you certain was not ""just a phase,"" but turned out to be totally just a phase?"	0
How do you prefer your hugs?	0
how do you deal with men being creeps?	0
"Sex workers, are there any clients of yours you've become genuine friends with?"	0
All women who play video games: What is your favorite game to play with your boyfriend?	0
Who was the worst client in your job and how you managed the situation?	0
Fellow bridesmaids...what are some outrageous things a bride required from you?	0
"What is something ""strange"" y'all do in public/when meeting someone to feel safe? Or am I just crazy??"	0
"Is it wrong to suggest that women would be better off without ""We're all beautiful,"" instead opting for ""I don't need to be beautiful, that isn't where my value comes from."""	0
"Ladies, what actions do you take when you feel your mental health declining?"	0
How old are you and what changes in female beauty standards have you seen during your lifetime?	0
How do you groom your hair during the time you haven’t washed it?	0
"Those of you who know the Bible enough to have a favorite verse, what is your favorite Bible verse?"	0
How do you sleep with long hair?	0
My fellow pad wearers- are you sick of other ladies telling you that you need to use some other kind of period protection? Just me?	0
"Women of Reddit, what is the funniest question of a women’s body from a guy?"	0
"Women making 6 figures annualy, what is it you do?"	0
What do you think of Stan Lee’s death?	0
What's the weirdest thing you've done as a result of social anxiety?	0
"Women who practice abstinence until marriage, how do you deal with your urges?"	0
"You have been given a $200 gift certificate to spend online, what do you purchase (Serious answers please)?"	0
What's your favorite get money/hustle/flex/I'm a bad ass song sung by a female artist?	0
How do you shake anxiety when life is going well?	0
"Ladies, how do you feel about your bf/husband using camgirl sites?"	0
What is your favorite joke that is a dig at men?	0
What small change have you made in your life that's helped to make you into a better person?	0
"Ladies, post a photo of that piece of graphite stuck in your skin."	0
"Women of Reddit, how do you feel about a boyfriend who walks ahead of you in public?"	0
What do you think when you see hot men dating women you consider ugly?	0
"Please tell me there is a subreddit for asking women relationship/dating advice, because this is out of hand."	0
"What is your ""best kept secret"" website that you visit that few know about?"	0
